RotaID,Origem,Destino,Distancia,TempoEstimado,RestricoesTrafego
4927,Lake Derektown,Lake Jennifer,374.02,02:00:00,Large every role attorney.
4928,East Xavierland,Port Arthur,776.24,04:00:00,Strong bar clearly company black.
4929,New Kristinport,Jesseborough,781.3,02:00:00,Station year miss.
4930,New Carla,Katherinechester,529.82,01:00:00,Billion remember wear do world.
4931,Port Sandraland,Port Reginaldhaven,239.22,04:00:00,Just east side hear second leader baby.
4932,Josephfurt,East Chris,499.79,04:00:00,Risk travel on body question usually.
4933,East Jonathanton,Nicholasland,326.99,01:00:00,Near beat guy.
4934,Charleshaven,Shortport,263.66,02:00:00,Network again guy.
4935,West Cheryl,Barronborough,251.34,03:00:00,Democrat establish memory health either pick.
4936,Martinezfurt,South Brian,602.13,04:00:00,Quite dog opportunity day film.
4937,East Jaymouth,Smithshire,912.07,05:00:00,College themselves four radio shake.
4938,Lake Shawn,South Rhonda,131.66,02:00:00,You full perform yeah.
4939,Russellton,Lake Mark,443.17,01:00:00,Ok avoid job accept stay speech.
4940,North Travisview,Kristinaton,733.79,01:00:00,End myself police.
4941,Kathleentown,North Erica,419.73,03:00:00,Them pattern turn.
4942,Maxwellborough,Rodriguezchester,702.53,04:00:00,Across economic rest night fire yes.
4943,Luismouth,Michellemouth,863.76,03:00:00,Leg sometimes true big coach tax.
4944,West Stephenmouth,East Anthonyville,650.93,02:00:00,Truth throw leave.
4945,West Christopher,Malloryport,149.45,01:00:00,Morning now camera you choice.
4946,Markhaven,New Willie,930.21,01:00:00,Report apply ok house check fall TV.
4947,New Paigeland,Angelaburgh,464.63,03:00:00,City unit your risk she resource.
4948,Harperview,North Holly,967.23,05:00:00,Right involve drive born necessary police.
4949,North Bonnie,Millsberg,583.68,03:00:00,Car feeling with people fish trial.
4950,Brandifort,Mikeshire,822.7,03:00:00,Family himself option body likely degree.
4951,Lake Margaretchester,Garciatown,174.02,01:00:00,Could guy assume like future sea.
4952,Port Theresashire,North Justin,602.68,04:00:00,Report court still official teacher threat they relationship.
4953,New Peter,West Paulatown,393.77,01:00:00,Remember kind bill.
4954,South Garyton,East Jesseton,707.24,05:00:00,Sell just upon western get purpose laugh pressure.
4955,Parkschester,New Sharonview,126.47,05:00:00,There language federal sing.
4956,East Ryanshire,Lake Glenn,866.68,02:00:00,Seat yet argue piece off.
4957,Wallston,Georgeview,863.02,05:00:00,Hour address list toward hot operation could.
4958,Velasquezberg,North Teresahaven,603.6,01:00:00,Lead main according life defense.
4959,Ryanfort,Buckland,187.31,01:00:00,Book collection true task off.
4960,Roseburgh,Silvatown,169.18,03:00:00,While day control wife war page.
4961,South Adamburgh,Courtneymouth,656.7,05:00:00,Bit process skin blood agency miss.
4962,New Jesseville,West Daniel,717.44,01:00:00,Discover reason response herself.
4963,Schmidtfort,South Edward,171.87,04:00:00,Contain hot front network.
4964,Colemanfort,Lindaside,417.98,03:00:00,Have different analysis.
4965,South Stephanieton,Robertsburgh,716.99,03:00:00,Change try blue claim.
4966,Washingtonmouth,North Donaldburgh,805.85,02:00:00,Power clear break loss break rock.
4967,Crystalburgh,Timside,829.41,04:00:00,Could tree edge follow evening usually kind protect.
4968,South David,Dustinmouth,913.59,03:00:00,Gas these degree.
4969,Ericaton,Porterchester,679.03,05:00:00,From responsibility partner surface their great increase.
4970,Leeshire,New Michael,615.09,03:00:00,Mouth strong middle lawyer.
4971,North Stephenfurt,Scottborough,904.54,02:00:00,Movie style win suffer.
4972,East Robin,North Christopher,236.84,04:00:00,Fill onto parent raise want.
4973,Lake Masonport,Whitechester,280.03,02:00:00,Positive realize movie spend political three serious.
4974,North Matthewhaven,West Kyle,785.52,05:00:00,Meeting reality vote size along important plan read.
4975,Jenniferville,Jacquelinebury,330.26,02:00:00,Whole off article I federal military dark.
4976,Thomasmouth,Port Samantha,490.37,04:00:00,World offer past here knowledge child party.
4977,New Stephanieside,Port George,673.59,02:00:00,Economy vote political start woman.
4978,Smithside,Lake Karen,102.78,03:00:00,Second skin police cup require program sign.
4979,North Lauren,Jeffreymouth,250.49,02:00:00,Management bar who accept bad quality.
4980,Edwardfort,Steventon,789.67,04:00:00,When organization choose spend development prove soon law.
4981,South Jennifer,North Amanda,709.84,04:00:00,Force air bit industry.
4982,Kimberlymouth,New Lisaview,225.09,05:00:00,Entire to soldier thought class small page.
4983,Kyleview,Jayton,180.61,05:00:00,End determine might lose form.
4984,Lake David,South Aprilfurt,465.45,03:00:00,Defense example speak his bag next a adult.
4985,New Josephhaven,New Jenniferfort,434.03,04:00:00,Month recently three election name condition join read.
4986,Loriville,Camposville,902.47,05:00:00,Begin think account.
4987,North Sarah,Harrismouth,646.65,04:00:00,Suggest with loss debate.
4988,Christinafort,Lake Theresamouth,374.69,04:00:00,Social candidate woman suggest.
4989,Nataliechester,Emilyville,798.82,02:00:00,Chance letter defense fall.
4990,Edwardborough,Lake Angelaville,363.74,01:00:00,Pretty participant ready tell sometimes commercial sport.
4991,East Deniseside,Rowehaven,814.83,01:00:00,Section product visit leader end husband hotel.
4992,East Sarahbury,Port Michaelmouth,276.47,02:00:00,Trial message order use lawyer.
4993,Lauriemouth,East Patrickfort,421.32,04:00:00,Green whole rich expect.
4994,East Derekberg,Penatown,594.54,03:00:00,Month kid go detail.
4995,Lake Pamela,Torresshire,359.22,04:00:00,Likely program as change information.
4996,Kiaraside,North Sharonburgh,609.94,05:00:00,Decide over ahead couple do myself exist look.
4997,New Robert,Port Charleneberg,364.48,01:00:00,Little protect you entire.
4998,North Marcus,Jillianberg,818.12,05:00:00,Decide explain find magazine might woman around.
4999,Burgessfurt,South Michelemouth,603.87,04:00:00,Brother sign gun range.
5000,Port Kevinchester,Port Monica,524.39,01:00:00,Crime cover sound page mind answer stage.
5001,Patriciaport,Kaylastad,595.6,04:00:00,Network later challenge local economic.
5002,Lake Amybury,Port Jennifer,339.49,04:00:00,Late personal happen me detail eight suddenly guy.
5003,Elizabethhaven,Port Nancy,266.31,04:00:00,Black feel to similar world.
5004,Russellside,Alvaradochester,224.82,02:00:00,Model war drop fight trip form among.
5005,West Kari,Alyssaport,885.46,02:00:00,Environmental professor population actually suggest.
5006,East Justinbury,Danielmouth,502.08,05:00:00,Large laugh young.
5007,Port Jessica,South Keith,944.98,01:00:00,Within serve week firm network early medical.
5008,Charlesland,Craigchester,255.62,02:00:00,Even fight shoulder maybe wish rather interesting.
5009,Rodrigueztown,Clarkstad,162.29,01:00:00,Person prepare discuss us.
5010,North Jessicaville,Lake Claudia,492.81,02:00:00,Husband talk goal avoid.
5011,New Fernando,Johnsonberg,556.27,02:00:00,Month memory yes new.
5012,Crystalchester,New Richard,402.25,04:00:00,Dark list report current ten yourself.
5013,Lake Amandashire,Mercerfort,630.42,05:00:00,Whatever along build weight institution senior.
5014,South Markfurt,East Renee,528.84,03:00:00,Week peace upon decide agree.
5015,East Janet,New Billy,162.79,03:00:00,Against system manager.
5016,Thomaston,Port Jamieland,283.16,05:00:00,While season site read practice stock space.
5017,East Michaelshire,Port Jamesland,206.71,05:00:00,Degree pull baby data minute ten note.
5018,South Cassandraton,Willisshire,940.56,03:00:00,Talk same social door significant general.
5019,Jessicaberg,Port Andrew,284.84,01:00:00,Special much foot town night while themselves.
5020,West Davidmouth,North Christina,926.29,01:00:00,Skill matter final west term enough door.
5021,New Amber,Stewartport,413.56,04:00:00,Data material smile wear effort strategy evidence.
5022,Port Kenneth,North Juan,913.77,04:00:00,Relationship create develop recognize support indicate edge.
5023,West Georgeville,Alexisshire,978.73,04:00:00,Buy where also agreement up born.
5024,Morrisberg,Vanessaburgh,769.32,01:00:00,While thank look collection event.
5025,North Christina,Donaldhaven,891.95,01:00:00,Decade vote common clear deal social purpose.
5026,Amberberg,West Andrew,830.78,01:00:00,Take risk agree learn impact shoulder.
5027,Sanchezview,Port Kristenfurt,377.03,05:00:00,Group total citizen research.
5028,Reedburgh,Lake Michael,904.98,03:00:00,Husband management throw he.
5029,Port Nicholasborough,Whitetown,185.12,02:00:00,Traditional onto firm course baby.
5030,Escobartown,East Kimberlyfurt,875.43,05:00:00,Wife push toward situation involve trouble administration.
5031,North Cheryl,South Gloriachester,153.31,02:00:00,Along similar hotel range vote while.
5032,South Deborahton,West Lindsey,235.01,05:00:00,Buy involve oil thought create.
5033,Mirandatown,North Mirandachester,412.74,05:00:00,Reflect require pretty store rate message.
5034,Kennethfurt,Nelsonmouth,132.81,03:00:00,Control specific certainly tax up television candidate.
5035,West Melvinland,North Charlesland,943.54,05:00:00,Capital board truth.
5036,Hernandezborough,Rossburgh,429.56,04:00:00,Something free strong our real.
5037,Joneshaven,Ericview,180.82,03:00:00,Situation while study southern can first radio.
5038,New Charles,Brianview,518.21,04:00:00,Federal language necessary.
5039,West Justinhaven,Kristyport,212.12,02:00:00,Weight student address group.
5040,Romerofurt,Collinsstad,486.8,05:00:00,Meet miss agent quality until turn song.
5041,North Bryanland,West Emilyport,610.53,01:00:00,Room feeling sit win street amount.
5042,Ellisonfurt,Port Richardside,234.73,01:00:00,She air itself the raise.
5043,Williamschester,North Deniseborough,450.2,03:00:00,Woman themselves do attack.
5044,Jameshaven,Roweburgh,685.15,05:00:00,This information pick language think impact fight policy.
5045,South Erin,East Anthony,866.57,04:00:00,Away pick particularly truth.
5046,Hallborough,Bradleymouth,752.63,04:00:00,Raise or list something help gun.
5047,Bendermouth,South Jeanne,276.29,03:00:00,Every week ahead wind project resource image.
5048,Cowanton,Deanborough,966.59,01:00:00,Race able continue station involve effort.
5049,Lopezfort,Port Lisabury,422.87,02:00:00,Station television ahead public memory might option believe.
5050,West Casey,Gomezton,592.34,04:00:00,Condition lawyer pretty career night image.
5051,Matthewton,Charlesbury,759.9,01:00:00,Through remember threat she information although.
5052,Lake Joshua,Cohenhaven,842.12,01:00:00,State young pretty wind.
5053,North Josephmouth,Jonesfort,440.71,02:00:00,Line relationship some loss consider.
5054,Port Megan,Youngmouth,828.25,03:00:00,Service east somebody still.
5055,Raymondville,Port Alexis,978.14,02:00:00,Congress long audience role American cup eat it.
5056,Collinsborough,Chapmanmouth,450.26,05:00:00,Age more indeed into.
5057,East Cody,East Michael,859.09,01:00:00,Style everything million where.
5058,Lake Joseph,South Michelle,586.7,03:00:00,Even will tonight let finish hot.
5059,East Clifford,South Angelabury,175.17,02:00:00,Bit itself happen over similar else.
5060,Jasonbury,Robertville,344.68,03:00:00,Spend price remain fact how quite society.
5061,Barnesview,Bentleymouth,683.65,02:00:00,Walk attention she give bed piece great.
5062,East Deborah,North Dominic,267.73,04:00:00,Program million center until.
5063,Martinport,Anthonyberg,208.85,05:00:00,Next for property model base clearly blood other.
5064,Timothystad,West Brian,610.79,04:00:00,Manager when majority like.
5065,North Feliciaburgh,Aaronport,374.22,02:00:00,American into heavy simply worry.
5066,Atkinsonstad,Saraside,425.0,02:00:00,Life enjoy three respond.
5067,Port Robertburgh,Donaldborough,233.84,01:00:00,Per serve citizen tree what.
5068,Port Michaelfort,Smithview,762.55,01:00:00,Wall push standard.
5069,Dustinberg,Mistyberg,871.83,04:00:00,Model population second probably president boy.
5070,Garciashire,West Melanie,891.15,04:00:00,Look step join staff.
5071,Ashleystad,Port Colleenfort,238.3,01:00:00,All out newspaper help.
5072,Hoffmanport,Andrewfort,697.49,02:00:00,Opportunity sort about coach size.
5073,Alexandriaview,Vaughanton,478.88,01:00:00,Do away successful save plan lead list.
5074,North Michelleton,Lake Justinhaven,637.21,03:00:00,Approach fill film truth why or ten information.
5075,Garyshire,East Allison,200.1,02:00:00,State economy miss grow hope.
5076,Sylviashire,Port Sheilaborough,595.37,03:00:00,Son after group between cold.
5077,Nelsonton,New Williamfurt,165.87,04:00:00,Cut high push knowledge.
5078,East Audreyland,West Garrett,254.96,03:00:00,Experience number yet hot paper.
5079,Mariaport,Kathleenmouth,503.65,01:00:00,Recently why sometimes organization none particularly usually herself.
5080,North Amandachester,Oliviaburgh,685.73,03:00:00,Score turn give.
5081,Brianfurt,Pamelabury,523.58,05:00:00,Rather model ball list boy she.
5082,New Bernardhaven,Humphreyside,494.98,04:00:00,Computer wife mother return save stay choose.
5083,Lake Joseph,New Williamfurt,167.61,02:00:00,Especially them hard place tonight night.
5084,Cummingsmouth,Miguelside,837.67,05:00:00,Leg media recently network moment need past.
5085,West Carolyn,Port Robert,363.94,01:00:00,Respond his common special.
5086,New Emily,Mendozamouth,402.7,04:00:00,Explain follow arrive soldier fill unit me.
5087,Scottville,Johnsonborough,394.39,04:00:00,Model present over both use.
5088,West April,North Travisside,534.22,01:00:00,Really voice term candidate church spend.
5089,Morrismouth,East Tammy,857.25,01:00:00,Race food instead goal last ok.
5090,Rhondastad,East Mark,192.91,05:00:00,Stock hot also few style so hope indeed.
5091,East James,Carterview,655.28,01:00:00,Why political point.
5092,East Rebeccamouth,Danielmouth,670.48,01:00:00,Husband carry baby remember laugh capital special decade.
5093,South Thomasside,Port Aliciaburgh,779.75,02:00:00,And general phone college month thought story.
5094,Kennethbury,Kimberlyland,185.54,01:00:00,Forget hear eat final former something.
5095,Lake Nicolashaven,Lake Linda,955.74,05:00:00,Artist bag debate couple professor together.
5096,Mooreberg,Port Katelynstad,811.33,01:00:00,Them push democratic although he talk.
5097,West Kim,Rachelhaven,439.25,04:00:00,Receive thought lose enter understand society responsibility value.
5098,Jonathanside,Martinezborough,971.97,02:00:00,Should wear glass quickly experience offer.
5099,Ericaborough,New Jeremyview,833.56,01:00:00,Billion all mean try visit little.
5100,West Josemouth,Dodsonside,470.03,02:00:00,Perhaps single project behind scientist.
5101,Andrewtown,South Jacobmouth,587.02,02:00:00,Every sort cold live idea.
5102,Jeffreyville,Jenniferside,722.42,05:00:00,Hair Republican hand general war.
5103,South Christopher,East Keith,122.7,04:00:00,Raise green town response stop wonder.
5104,Fisherchester,Lindaville,233.78,01:00:00,Single approach reveal listen tell statement.
5105,Carrollfort,New Adam,838.92,05:00:00,Allow determine than exactly.
5106,North Darinstad,Suzannestad,394.36,04:00:00,Table model reveal arrive.
5107,Wrightport,Warrenchester,558.82,03:00:00,Wonder design law money away.
5108,South Christy,South Karaburgh,828.11,05:00:00,Hour most too daughter necessary clearly order.
5109,Gateshaven,Tinahaven,646.8,03:00:00,Friend reveal both laugh game author goal.
5110,Burchland,Nathanville,353.28,04:00:00,View stage traditional season.
5111,South Rachelshire,Lake Justinview,268.62,03:00:00,Apply clearly defense sit.
5112,Sextonstad,West Thomas,467.23,03:00:00,Necessary style other professional term about decade pattern.
5113,Port Tommy,Nathanton,250.69,04:00:00,Science billion collection follow station rather ability by.
5114,Patrickmouth,Angelaland,847.96,01:00:00,Use wide account simple this real.
5115,Donnafort,Hurleyborough,626.69,01:00:00,Hold sister whether bed.
5116,Ashleystad,Scottmouth,412.97,02:00:00,Look song operation.
5117,Lake Adam,New Kenneth,311.2,04:00:00,Player already bad site you somebody window.
5118,South Amandaborough,East Melodyport,641.36,03:00:00,Seat your become team force however.
5119,Amberfort,West Jennifer,345.57,05:00:00,Their reveal thought wonder road say.
5120,South Waynefurt,Whitneyfurt,292.65,02:00:00,Produce speak perhaps year since term.
5121,Brendanmouth,Katherineborough,825.72,02:00:00,Arm tend quickly such he seem.
5122,Deborahfurt,Reeseview,792.9,02:00:00,Painting day cell last.
5123,Robertstad,Meganborough,183.39,04:00:00,Hair him region such small several.
5124,West Shaunhaven,North Christian,893.17,01:00:00,Best piece character education term.
5125,New Carolynland,South Donald,525.27,05:00:00,Great well base example east.
5126,West Benjaminbury,Jeffreyberg,909.53,01:00:00,Later government fish.
5127,Sotoville,East Victoria,678.36,01:00:00,Significant beat amount.
5128,Debrabury,Lake Rickyfort,892.82,01:00:00,None Mr second trade individual.
5129,Garciabury,Churchtown,159.44,04:00:00,Century box conference.
5130,New Tonyaburgh,West Susan,225.42,02:00:00,Property idea night factor up building food.
5131,Jordanside,East Randyborough,851.88,02:00:00,Our service which door.
5132,Boyershire,Mcgeechester,803.34,02:00:00,Carry around book common.
5133,Lake Luke,Joanshire,188.41,03:00:00,Democratic trip along prevent understand resource animal.
5134,Deanview,Thompsonchester,528.27,01:00:00,Note action couple rise thus marriage.
5135,East Melanie,Chenfurt,835.43,03:00:00,Possible start energy eye choice.
5136,Wesleyview,Stewartside,579.88,02:00:00,North analysis front area section group theory.
5137,North Jenniferton,South Jamesport,438.21,04:00:00,Speak forget lay movie away.
5138,Cindyburgh,Gallegosville,843.57,05:00:00,May too change product scene turn support.
5139,Heatherton,Lewisstad,643.15,01:00:00,Activity relate other attorney.
5140,Port Carrie,Brooksfort,806.64,04:00:00,When buy cell short make.
5141,New Chelsea,Port Eric,547.2,05:00:00,Executive whether save young there far receive small.
5142,West Rachelhaven,Port Sherri,331.12,04:00:00,City of myself.
5143,Charlesstad,Port Rebecca,888.11,05:00:00,Material person worry charge near green.
5144,Travisside,Klinefort,724.91,02:00:00,Down would job stage deal get collection.
5145,Adamshire,North Leahview,216.1,02:00:00,Old scientist degree six group Congress serious table.
5146,Robertchester,West John,628.35,03:00:00,But fight star detail.
5147,Carlport,Lake Shelbytown,964.09,01:00:00,Discuss exactly address whole write.
5148,Penamouth,Muellerfort,336.62,02:00:00,Purpose writer room analysis argue western difficult.
5149,South Amandatown,Brandytown,252.53,05:00:00,Animal college seem job rather.
5150,Matthewmouth,Montoyaborough,385.47,03:00:00,Now time network.
5151,North Anthonyfort,Port Jonathon,496.21,02:00:00,Morning policy brother food agree system night.
5152,Lake Thomas,Port Joseph,834.98,05:00:00,Ask various suffer light add military we.
5153,Nguyenberg,Port Diana,748.57,04:00:00,Traditional hear during our age manager.
5154,Colemanmouth,Nicolefurt,982.26,04:00:00,Practice yes visit three owner consider Mrs.
5155,Port Walterville,Riveratown,229.82,05:00:00,About know role design help.
5156,Garzaview,Thomasberg,991.17,05:00:00,Interview present garden little benefit cup machine.
5157,New Lauren,Rileyberg,317.76,01:00:00,Save same build bring phone service.
5158,Port Rachelshire,East Elizabeth,928.7,04:00:00,Capital time bag international whatever.
5159,South Andrew,East Dawn,712.42,03:00:00,Plan race already product.
5160,Hernandezside,Wangside,604.05,02:00:00,Himself television former air have become.
5161,Terristad,North Stephanie,838.43,03:00:00,Woman little green region.
5162,South Carmenland,East Chris,152.86,04:00:00,Cup leave outside economic prevent population structure.
5163,Port Brianview,Rachelside,451.57,03:00:00,Behind never street my room group.
5164,New Ryan,Williamview,216.47,03:00:00,Suggest spring follow determine approach people have get.
5165,Wangshire,Tinastad,301.74,01:00:00,Million event tree should.
5166,Port Michael,Danielmouth,693.16,05:00:00,Smile girl officer player spend use.
5167,Vanessaport,Timothyport,908.47,01:00:00,Goal fear and from.
5168,Lake Kristen,Lake Dawn,156.13,02:00:00,Enter wall front.
5169,North Heather,Serranoview,741.5,03:00:00,Affect physical window deep while may hold.
5170,South Lisa,Brianport,286.93,02:00:00,School soon maybe while station.
5171,Hallville,North Jessicafort,743.24,03:00:00,Improve hold various start detail mouth start shake.
5172,Shawnfort,Brownberg,997.44,03:00:00,Produce program lot technology off view.
5173,Stevemouth,South Jasonmouth,369.88,05:00:00,Peace truth bag physical partner hair.
5174,North Luismouth,Stevenberg,546.32,03:00:00,Main account officer week quality field.
5175,Lake Scottport,Laramouth,483.52,01:00:00,Thus officer raise describe authority.
5176,New Shanemouth,East Keithhaven,730.47,01:00:00,Charge law budget respond keep.
5177,Port Alexandria,Lake Elizabeth,493.27,02:00:00,Onto unit card trade look check such.
5178,Lake Samantha,Lake Katrinamouth,882.72,05:00:00,End want animal scene responsibility we husband.
5179,North Allenburgh,New Anthonyland,471.55,05:00:00,Impact business whose for.
5180,Hernandezview,East Heatherfort,766.11,02:00:00,Skin case happen sense.
5181,West Taylor,Thomasbury,210.03,01:00:00,Affect write along very child single.
5182,North Cassandraview,Ianton,962.92,05:00:00,Strategy beyond call town service.
5183,East Carl,Blackbury,708.09,05:00:00,Interest summer network door new doctor.
5184,Port Keith,Port Jenniferburgh,845.45,03:00:00,Shake majority manage big.
5185,Lake Gabriellaborough,Nicholsmouth,275.46,03:00:00,Prepare interest future conference.
5186,South Donaldberg,South Russellberg,361.38,01:00:00,To data bag way near travel boy.
5187,Wallerfurt,Lake Christopherview,485.13,04:00:00,Billion product significant suffer article certainly then.
5188,Port Karen,Davisville,339.82,02:00:00,Land save theory already player soldier.
5189,North Robertoport,Port Williamhaven,182.95,05:00:00,Everyone responsibility visit have police civil certainly.
5190,Dianemouth,Kimberlychester,690.82,02:00:00,Reveal ask husband.
5191,South Nicole,Lake Robertfort,578.0,05:00:00,Cell herself prove movement simply hope protect.
5192,Howeburgh,Christopherton,269.35,02:00:00,Low serve whole fear relationship.
5193,Jenniferchester,North Frederickview,400.32,03:00:00,Seek scientist whom measure nothing final piece.
5194,West Michael,Fergusonborough,653.25,01:00:00,Any power so sit.
5195,Stevenfurt,Troymouth,589.73,02:00:00,Space game seat success including short material.
5196,Mccarthyshire,Jameschester,339.74,02:00:00,Parent part administration.
5197,Port Davidburgh,West David,973.32,02:00:00,There true home last method.
5198,West Sarah,East Melindaview,511.02,01:00:00,Model project future loss future professor.
5199,South Timothy,East Heidiville,756.69,03:00:00,Sound majority however white conference bank employee.
5200,Ryanbury,North Timothyborough,245.07,05:00:00,Main stage step keep final.
5201,Adamside,Ericbury,910.5,05:00:00,Fly sometimes nice rule condition.
5202,New John,North Jacquelineport,347.27,03:00:00,Stay would name dog kitchen husband.
5203,Kimberlyfurt,Georgeland,496.34,02:00:00,Point create yet others grow.
5204,West Ashley,East Kristen,727.07,05:00:00,Itself unit last edge feel notice.
5205,East Nicoleborough,South Adamshire,662.59,02:00:00,Challenge which quality.
5206,New Emilymouth,Catherineburgh,175.09,03:00:00,Benefit tough project whether.
5207,Guerreroport,Lake Zacharyburgh,909.02,03:00:00,Firm subject senior green them rich write.
5208,Wyattburgh,New Elizabethbury,490.91,01:00:00,Voice rest seven choice seem door use I.
5209,Port Karenfurt,Aaronview,856.66,02:00:00,Floor affect every get result.
5210,East Troy,Paulview,573.46,04:00:00,Owner still agency.
5211,West Chelsey,Angelaville,227.52,02:00:00,Send blue back establish important actually key.
5212,Lisaland,Paynehaven,179.03,02:00:00,Couple site hand anything body should.
5213,Lake Tammy,East Marcmouth,984.11,02:00:00,Fly shoulder concern out those set.
5214,Brianview,East David,242.33,01:00:00,Enjoy population now improve read point.
5215,Williamsberg,East Ruthview,164.92,02:00:00,Prepare tell power.
5216,East Jenniferland,Donaldtown,327.2,01:00:00,Mind avoid indicate something guy.
5217,Younghaven,East Phillipfurt,479.93,03:00:00,Major although level reach assume indeed science.
5218,North Renee,East Sarah,346.2,05:00:00,My even live if human fund.
5219,Port Seanchester,Hannahbury,269.94,02:00:00,Front give nor.
5220,Gomezhaven,Peterberg,319.2,02:00:00,Agent sit tell when stop per clearly strategy.
5221,West Charles,Leetown,282.66,02:00:00,Green court discuss what over right room.
5222,Melissamouth,New Jeremiahmouth,106.01,04:00:00,Main power president recently personal.
5223,New Daniel,Taylorborough,813.82,01:00:00,Young magazine sing figure citizen cell range whole.
5224,Amandahaven,Nicoleside,145.14,01:00:00,Fact number center across receive moment.
5225,South Brandifort,East Markburgh,268.71,05:00:00,Sort movie son choice off while population.
5226,Angelaport,Hornside,622.86,02:00:00,Structure training go common sense raise.
5227,North Johnnyborough,West Rogerstad,186.63,03:00:00,Another fine during sit.
5228,Lake Vanessa,Wendyland,585.44,05:00:00,Table modern wide four.
5229,South Andrewtown,Christensenmouth,360.81,02:00:00,Eat protect real into build.
5230,Guerreroport,South Susanville,281.63,05:00:00,Analysis that pattern.
5231,Port Jessica,Gilbertview,397.72,03:00:00,Child company save Mr.
5232,Jenningsborough,Christopherport,765.69,03:00:00,Explain east fly.
5233,East Ricky,Stephenbury,570.96,01:00:00,Table knowledge herself him science agent toward.
5234,Schmidttown,Whiteborough,960.01,04:00:00,Him page agreement home.
5235,Ochoaborough,South Jason,932.23,03:00:00,Discuss seat travel wonder book that.
