RotaID,Origem,Destino,Distancia,TempoEstimado,RestricoesTrafego
1,Kerryton,South Dustinville,546.2,05:00:00,Enjoy bill street major customer keep.
2,South Edward,Charlesport,792.19,02:00:00,Grow room save board into claim.
3,West David,Adamsborough,166.53,05:00:00,Always use there hospital report act.
4,West Patrickborough,New Kristenside,185.33,01:00:00,Finish lawyer training because.
5,Michaelmouth,Smithmouth,550.46,01:00:00,Strong whose year may production investment teach.
6,Masonside,Davisside,483.4,03:00:00,Huge gun quickly may former.
7,Chaseton,Glenhaven,567.88,05:00:00,North hold example station natural three dark.
8,Parksberg,Wilsonmouth,146.74,02:00:00,Wait kitchen scientist somebody million adult.
9,West Brandonshire,Mandyside,176.65,02:00:00,Trial activity expert rock.
10,Roberthaven,South Stephanie,268.37,04:00:00,Image important audience hundred authority authority four.
11,Lake Mark,Conniebury,393.98,02:00:00,Nature home yard write become.
12,New Keith,Gallegosport,274.52,01:00:00,Benefit floor morning image deep serious buy.
13,Harrismouth,Joshuaburgh,147.87,03:00:00,Perform collection back around water.
14,Michaelfort,South Rachael,688.94,05:00:00,Say large anything.
15,Reyesview,Chadland,487.54,05:00:00,Finally already us condition agree.
16,Livingstonmouth,East Julieport,312.75,02:00:00,Door upon never true they simply recognize.
17,Kellyfort,Port Jennifermouth,607.95,05:00:00,Outside rate century street make inside author.
18,West Christineville,Port Debra,809.8,05:00:00,Dream build what value.
19,East Brent,Carlosport,224.78,02:00:00,News difference newspaper practice another how enter create.
20,South Stephanie,Matthewborough,765.4,05:00:00,Themselves explain difference activity so great ten operation.
21,North Jameschester,North Gene,708.39,02:00:00,Reflect evening true head.
22,South Martinmouth,Danaburgh,449.73,03:00:00,Yeah tend must and trouble city series.
23,New Barbaraberg,North Edwinborough,126.18,01:00:00,Family contain worker your.
24,Jillshire,Dianaburgh,591.09,04:00:00,Share away wear respond.
25,Jensenburgh,New Kristenland,288.77,03:00:00,Special read once person more.
26,Lake Marcusfort,Johnview,194.15,03:00:00,Officer break window goal mean.
27,Jordanbury,Thomasmouth,532.95,05:00:00,Spring image difference hot defense kitchen police.
28,South Kelly,North Michael,497.11,02:00:00,Simple character reason scene future PM quickly color.
29,Kirbyberg,Mckayport,454.17,04:00:00,Industry opportunity again yourself save the.
30,Orozcostad,East Dustin,502.42,02:00:00,Affect produce international kid.
31,Jacobville,New Lisashire,540.78,02:00:00,Collection star store team laugh finish opportunity.
32,Jerryshire,Jasonland,179.09,05:00:00,Might learn future discussion.
33,Lake Mary,Chasestad,660.78,03:00:00,Movement authority join sound from many.
34,Port Vanessaview,East Maryland,882.15,05:00:00,Strong social at write system we read.
35,New Michael,Josephchester,815.0,01:00:00,Evening newspaper compare.
36,Samuelhaven,Nicholasland,174.08,03:00:00,Finally soldier white key.
37,Stricklandberg,South Jonathanview,901.62,01:00:00,Identify movement body continue certainly discover drop.
38,West Adriana,Stacyton,736.91,03:00:00,Together method money low true decide.
39,Lake Josephberg,Port Brianton,522.34,03:00:00,Explain close seek degree suffer find.
40,Monicastad,West Teresa,434.19,02:00:00,Quite cold economy policy thing everybody.
41,Jacobsport,West Matthewberg,971.73,05:00:00,Blood task stage assume right tough until.
42,South Karen,Lake Dylan,519.7,04:00:00,Anyone find wrong would whatever.
43,Tiffanyside,Kellyborough,686.23,04:00:00,Fear agree stop enter race.
44,Port Kelsey,South Jenniferville,816.76,01:00:00,Top step time soon own film music.
45,East Michael,Huffville,582.43,04:00:00,Discover though carry wide up television entire debate.
46,Port Mariah,South Jennifer,270.66,01:00:00,Too occur reduce remember particularly.
47,Hughesside,New Courtneymouth,447.47,02:00:00,From eight gas once region simple.
48,Lake Abigailmouth,Jonathanview,397.94,01:00:00,Look after soon key.
49,East Karen,Jamesburgh,128.28,03:00:00,Glass back democratic security drop.
50,Lake Adrianview,Kimmouth,945.52,03:00:00,Air phone east hit civil themselves.
51,North Olivialand,South Matthew,986.2,03:00:00,Ten hundred seat draw serious such notice somebody.
52,Lindachester,Davidton,742.16,03:00:00,Experience scientist consumer central relationship one single nothing.
53,Weisshaven,Evanville,744.83,03:00:00,Support clearly different family very figure wall.
54,Loweborough,West Timothyport,885.44,04:00:00,Adult among particular score important.
55,Househaven,New Timothy,863.55,05:00:00,Letter activity his mind.
56,Port Lisa,South Courtneyton,149.98,01:00:00,Of audience ok physical capital street.
57,Alishachester,Turnerberg,385.13,05:00:00,Also matter boy staff scene.
58,South Raymondton,South Michelle,586.9,02:00:00,Suffer policy foot finish.
59,South Andrewstad,North Michael,478.54,05:00:00,Citizen address increase reflect college material.
60,Morganbury,Meghanstad,538.67,05:00:00,Leave let bag network.
61,Port Jasmineberg,West Joseph,529.38,05:00:00,View fire dinner pick.
62,Woodsland,Johnathanview,128.46,04:00:00,Traditional situation assume trouble approach.
63,Gutierrezhaven,Melissaview,713.72,01:00:00,Wrong third indeed land court.
64,Berrybury,Lake Stevenburgh,755.78,01:00:00,Car short our summer blue under war.
65,New Kerrystad,Donnaburgh,545.48,05:00:00,Serve interview its pick early seat find drive.
66,South Paula,Kimberlyshire,952.59,01:00:00,Her marriage career figure.
67,Aliciaton,North Davidfurt,889.46,05:00:00,Fast begin college.
68,Bellberg,West Benjaminshire,213.46,02:00:00,Else get lay successful before research red.
69,Kristinetown,West Laurenville,110.72,02:00:00,Lead establish dog myself.
70,Melaniefurt,West Andrew,569.92,02:00:00,Radio girl care between decide.
71,West Darrenshire,Shepardview,938.27,03:00:00,Friend well may American.
72,Lake Peterbury,Lake Tonyastad,718.8,03:00:00,Prepare would former senior may.
73,Davidburgh,North Jenniferborough,728.62,02:00:00,Travel ball really minute affect.
74,Dianaburgh,Stephenville,132.39,01:00:00,Mission although actually crime table need in.
75,Davidland,East Petershire,733.81,04:00:00,Indicate single reach myself fall.
76,Hessborough,Loganfort,961.44,01:00:00,Various western run team traditional technology.
77,North Brandon,Wilsonland,323.39,03:00:00,Southern candidate paper small until democratic.
78,Veronicafurt,Garyside,952.03,03:00:00,Several consider general discussion religious say support.
79,Parksville,West Wandaburgh,885.76,03:00:00,Worry after bad.
80,New Erica,East Logan,609.12,04:00:00,Blue pull protect visit some.
81,West Heather,Kathyville,635.87,01:00:00,First become matter certainly carry animal participant player.
82,Jessicaborough,Port Christopher,744.4,03:00:00,Morning rule likely work build fact step himself.
83,North Rebecca,West Richardfurt,401.81,04:00:00,However future wrong painting participant describe.
84,West Frederick,South Jonathan,876.9,03:00:00,Require shoulder use against probably.
85,Perryport,Maxwellview,100.67,02:00:00,Region church maintain in officer compare share.
86,Ritahaven,Barbarastad,914.81,01:00:00,Huge street less term.
87,South Jamestown,Lake Mark,238.95,04:00:00,Cover whatever almost to about.
88,Velasquezmouth,South Vanessa,543.55,01:00:00,Kid land ability degree place modern.
89,West Lynn,Williamsmouth,756.77,04:00:00,During describe second.
90,Shawnville,South Charles,504.23,04:00:00,Exactly across party purpose.
91,Acostatown,Port Eric,373.45,03:00:00,Ask side return.
92,South Jeffside,Molinabury,663.89,02:00:00,Present two word thousand sister because firm all.
93,Greentown,Laurahaven,346.59,05:00:00,Amount economy win require positive power.
94,New Stephenview,New John,813.55,02:00:00,Particularly look expect find behind.
95,Williamsberg,Spencerville,893.25,01:00:00,So suffer billion little a.
96,New Tina,New Teresa,375.82,05:00:00,Head national subject common able.
97,West Carla,Morrisside,459.98,02:00:00,Ever response beyond able.
98,Curtisborough,West Juliefurt,392.34,02:00:00,Lose certain actually according allow.
99,New Lisashire,Kevinfort,408.24,02:00:00,Peace south make can.
100,New Amandaside,Bradyborough,296.24,02:00:00,Cost student offer such after.
101,New Kimberly,Frenchton,906.41,01:00:00,Challenge later side while attack amount myself offer.
102,North Benjaminshire,Kimberlyhaven,300.62,02:00:00,Matter message institution young debate impact.
103,West George,Veronicaburgh,225.95,02:00:00,Talk bit fine.
104,Estradafort,Kimberlyhaven,591.41,04:00:00,Summer miss those nothing risk fear class.
105,East Lorraine,East Heather,967.93,02:00:00,Several role remain growth there system offer.
106,Paynefort,Billychester,795.45,03:00:00,Soldier wind different available member.
107,Bowmanborough,Mayfurt,260.18,01:00:00,Strategy upon year least about.
108,Jasminebury,Lake Cameron,799.28,03:00:00,Foreign dinner detail available.
109,Breannastad,Aguilarview,299.96,01:00:00,Might then prepare key huge trip doctor.
110,Kristinafurt,North Johnmouth,794.66,03:00:00,Raise heart red important like nearly.
111,East Danielview,Normaton,154.23,02:00:00,Realize natural painting discover.
112,Sherristad,Reedville,327.72,02:00:00,Magazine forward tree meet only herself process.
113,Brandonmouth,North Steven,428.46,04:00:00,Deal well contain family.
114,Chapmanfort,Lake Mark,755.38,01:00:00,Sign put baby successful add not develop.
115,West Johnfurt,North Deanna,221.3,04:00:00,Area role culture knowledge thought several agreement.
116,North Jennifer,Tinaview,994.89,01:00:00,Bring six far debate would.
117,Nathanland,West Kimberlychester,363.81,03:00:00,Stock major mother either feeling ask despite production.
118,West Melissaborough,West Russell,349.56,02:00:00,Service cell bad laugh type easy bit.
119,Lopezland,South Susan,608.6,01:00:00,Ask each keep prepare see they.
120,South Timothyfort,South Katrina,471.89,02:00:00,Market language marriage hope.
121,Scottberg,Jacquelinefort,946.83,02:00:00,Anything eight they life training type allow military.
122,New Virginia,West Christopher,118.9,03:00:00,Probably allow social check strong effect bank hotel.
123,Brandonshire,Harrisburgh,801.18,02:00:00,Section arm sure physical bank success perhaps cost.
124,Andrewsberg,Lake Brett,499.89,01:00:00,Source drive rich economy else shoulder.
125,Lawsontown,West Susan,383.62,03:00:00,Science front year so stock.
126,New Olivia,Christopherport,152.86,03:00:00,Black sport scene key stop each treatment.
127,Davenportmouth,East William,474.18,02:00:00,Nearly full thus collection onto worry.
128,Donnaport,New Johnnyton,961.69,01:00:00,Information almost help talk window.
129,South Dakota,East Hectorview,850.75,03:00:00,Last pressure wish music land.
130,East Raymondburgh,West Stephanie,339.68,03:00:00,Enough southern past prevent scientist will provide.
131,Reginahaven,New Darrylburgh,161.74,05:00:00,Son people daughter doctor.
132,Schroederview,Lake Robert,942.29,04:00:00,Tax picture Congress specific remain attention natural.
133,New Kristen,Mccarthybury,315.55,01:00:00,Apply security interest standard prevent clear nice.
134,Michaelchester,Smithstad,414.93,03:00:00,Bar small method traditional ground from law modern.
135,Kimchester,West Kevinhaven,900.4,01:00:00,Source short himself discuss free investment any.
136,Nancymouth,Port Nataliefort,209.46,01:00:00,Room treatment Mr hour life cost similar.
137,East Willie,Katherineland,302.54,04:00:00,Suggest remain east enough tonight rock.
138,New Jennifershire,Jessicamouth,301.86,05:00:00,General agency animal ground.
139,New Robertbury,East Jason,514.95,02:00:00,Seek hair issue whether catch form officer hundred.
140,Jamesburgh,New Sabrina,690.15,01:00:00,Reality growth character new.
141,Singletonberg,West Joshuafurt,941.35,05:00:00,Nice national order in.
142,West Danielshire,Lopezside,132.38,02:00:00,Green court affect despite administration.
143,South Feliciaburgh,Whitneychester,829.61,03:00:00,Forward live walk sing range fund special.
144,East Angelica,Ryanview,633.36,02:00:00,Those design off their spring ask.
145,New Mary,Burnettburgh,517.78,01:00:00,Thousand magazine these party.
146,South Karamouth,Jameston,287.86,03:00:00,Man impact street support.
147,New Lindsay,Port Kathy,887.06,05:00:00,Much rather until miss hundred home forget.
148,South Zacharyshire,South Michaelmouth,355.65,04:00:00,Drop home month small have.
149,North Nicole,Port Samuel,460.06,03:00:00,Bill set believe customer the.
150,South Anneview,Dillonmouth,448.41,01:00:00,Hope career Congress step ahead discussion.
151,South Amanda,East Tracychester,559.58,01:00:00,Seek author begin for.
152,Josephfurt,North Edwardshire,892.96,04:00:00,Power question win whose option listen spend half.
153,Robertton,East Michellebury,822.2,02:00:00,Story focus she research arm.
154,Crystalmouth,Jasonstad,776.54,03:00:00,Republican thus adult.
155,Sydneyberg,East Jason,745.8,05:00:00,Again exist either keep.
156,North Gregory,Samuelhaven,550.42,05:00:00,Page policy really wall office mother whose.
157,Port Adrianborough,Carolinefort,136.74,04:00:00,Cup full friend yet.
158,West Wendyfort,Sarahtown,577.29,05:00:00,First technology war position rate citizen beautiful attention.
159,Walkerberg,West Adam,819.55,01:00:00,Exist grow civil happy especially political stuff.
160,South Coltonstad,Paulburgh,262.28,01:00:00,Management region sense allow interesting movement college.
161,Anthonyborough,Michaelton,343.82,03:00:00,Keep describe institution wrong respond action dream.
162,Port Matthew,Port Mark,945.06,04:00:00,Despite stop account TV.
163,Scottbury,Port Danielview,424.81,02:00:00,Meeting charge agreement would across trouble.
164,South Seth,South Justin,551.97,01:00:00,Room whose could likely allow discussion herself.
165,East Jennifer,Craigfort,981.15,02:00:00,Responsibility performance nearly movement image according eat learn.
166,Woodsfort,Lake Wendy,521.81,05:00:00,Indeed within green past.
167,Simpsonville,Christineside,542.09,02:00:00,Common director structure staff figure page fly.
168,West Dariusland,South Ericton,903.92,05:00:00,Eat he Mr once might.
169,New Bruce,South Clintonshire,656.87,04:00:00,Call size give plant gas.
170,New Valeriefurt,Michelleburgh,738.53,02:00:00,Morning learn ago manage.
171,Mcgeeborough,North Gary,875.76,04:00:00,Long citizen indicate quite carry minute.
172,Michaelview,East Bethany,473.67,05:00:00,Agency science study similar hotel.
173,Rubenton,East Davidburgh,714.95,03:00:00,Imagine hotel bag air whatever effort.
174,Mcdonaldchester,Alisonfort,557.03,04:00:00,Go read experience best our now.
175,Debrashire,New Collinborough,533.46,02:00:00,Develop new subject result ever since.
176,East Davidmouth,Youngfort,933.99,01:00:00,Get expert state big interesting.
177,Blackmouth,Kelseyhaven,731.13,01:00:00,Language art physical statement across.
178,Jeffreyport,East Elijah,981.58,04:00:00,Attack its federal such indeed study.
179,Davidton,Port Jerome,735.18,04:00:00,Soon affect he research.
180,Dianeview,North Jasminestad,165.61,05:00:00,Quickly mouth same growth fact hold anything.
181,East Jacquelineport,Lake Amandatown,908.12,01:00:00,Close design positive politics necessary.
182,North David,Gregoryshire,767.31,04:00:00,Season country resource feeling.
183,Jacksonshire,Lake Carolfort,774.77,05:00:00,Sure school increase product wait young really.
184,Josechester,Goodwinhaven,304.15,01:00:00,Garden than executive sometimes.
185,Port Lawrence,Travisstad,822.69,05:00:00,Black light finally and wall information.
186,Michaelport,Josephchester,167.73,02:00:00,For single necessary particular history apply actually.
187,Lake Philipburgh,Brewerton,809.4,01:00:00,Share indicate guy of.
188,North Kevin,Troymouth,872.42,05:00:00,Nearly none everything week.
189,South Samanthaburgh,Lake Christopherstad,831.44,02:00:00,Mean serious property official member.
190,Justinmouth,Lauraborough,287.53,05:00:00,Several place buy number argue north list.
191,Andersonchester,West Thomasfurt,417.31,03:00:00,Hold become young public.
192,South Tina,Lake Johnburgh,880.74,03:00:00,National base sing sell property no instead.
193,Port Rogermouth,Sharonville,668.29,02:00:00,Say than kid who grow subject report.
194,Port Williamstad,Mistyberg,364.35,03:00:00,White that everyone cultural.
195,New Samanthaburgh,Port Susan,443.63,02:00:00,Allow collection door.
196,Cordovahaven,North Carla,533.56,03:00:00,Section recently agreement investment hospital.
197,Blakeshire,West Misty,897.28,04:00:00,Parent outside soldier sort skill process close.
198,Youngburgh,Port Zacharyburgh,480.14,01:00:00,Conference response first degree other.
199,Mikefort,New Joshua,937.61,01:00:00,Financial current stuff.
200,Campbellfurt,New Ashleyton,210.69,05:00:00,Begin story yes hour camera citizen director.
201,North Peter,Port Oliviaburgh,957.45,05:00:00,Officer need discuss option view.
202,New John,Hurstshire,265.73,04:00:00,Dog eight professor option.
203,New Chasefort,Lake Pedro,273.97,05:00:00,Old or get skill marriage shake police.
204,East Cheryltown,Kimton,274.63,03:00:00,Realize certain price table technology base.
205,Harristown,Michaelville,707.66,05:00:00,Far way later list structure page.
206,Johnberg,Jacobport,721.07,04:00:00,Goal word book create democratic remember.
207,Richardsonfort,Harrellfort,154.97,02:00:00,Few choice fast executive later until.
208,Jenkinsmouth,North Alex,958.87,04:00:00,Get single owner assume cover dinner.
209,South Nicole,New Jose,575.8,03:00:00,Relationship good show.
210,New Jasmine,Port Michaelstad,388.13,03:00:00,Get unit list manager some speak food.
211,South Jessemouth,Martinport,875.56,01:00:00,Smile lawyer decide light impact pick.
212,Lake Anthony,Allenbury,379.15,04:00:00,Idea rather station.
213,North Travisburgh,New Shannonfurt,434.31,01:00:00,Term word investment anyone him.
214,Freemanville,Port Heidi,419.36,01:00:00,Special who sit us paper cut TV.
215,New Sandraport,Gallagherbury,171.36,05:00:00,Traditional marriage according thought development customer system cold.
216,South Rachelborough,Port Erichaven,967.93,03:00:00,Politics first good international.
217,East Brandonmouth,West Mark,926.98,02:00:00,Maybe end pattern she.
218,Joshuaburgh,New Shawn,812.67,05:00:00,President serious or push pull better purpose break.
219,Lake Williammouth,Port Sheila,298.7,02:00:00,Listen somebody that answer.
220,Rodriguezfurt,Jenniferside,929.31,01:00:00,Just Republican certainly whether.
221,Schroederport,West Joseph,583.39,02:00:00,Practice appear wide investment same.
222,Lake Heathermouth,Stevenbury,178.06,04:00:00,Drive view into much write us ball.
223,Jeannemouth,West Bruceshire,239.55,04:00:00,Difference baby brother can condition career.
224,Jonesside,Amberbury,367.83,04:00:00,Someone standard party event team group.
225,Pamelashire,Amandamouth,392.84,04:00:00,Either very former shake society.
226,Christopherburgh,West Amyfurt,799.61,04:00:00,End cover action office discover top picture.
227,New Mary,Elizabethside,934.03,04:00:00,Agent however after weight along.
228,Davischester,Mejiaton,662.2,04:00:00,Book as tough teacher lead respond.
229,Robertland,East Katherinefort,580.61,03:00:00,Call top among everything.
230,East Melissa,East William,167.73,04:00:00,Clearly system why kid join job must.
231,Jonathanport,West Ronald,444.64,04:00:00,Artist traditional order avoid.
232,Lake Teresaville,Susanview,188.2,03:00:00,Tonight program identify first.
233,Masonhaven,South Nicholas,396.49,02:00:00,Save trade bad center store course often.
234,Lake Brianhaven,Laurenport,713.53,04:00:00,Bad history agree section act face ground.
235,Williamsburgh,Rollinsshire,195.34,01:00:00,Agent put local official.
236,East Kelseyville,Port Jameshaven,152.23,02:00:00,Thousand push assume president.
237,Lake Holly,South Rhonda,883.45,05:00:00,I care pressure collection director.
238,Adambury,Andreatown,339.67,04:00:00,Whole defense boy this condition.
239,West Anthonyport,New Aliciaton,285.43,02:00:00,Billion man able region marriage side.
240,North Jonathanberg,Williamfort,940.41,05:00:00,Professional color computer.
241,Andrewbury,Tylerstad,367.01,04:00:00,Week medical across item network involve Republican future.
242,Terrymouth,Wolfebury,991.65,05:00:00,Financial much simply director establish machine body.
243,Brookeshire,Schmidtburgh,934.31,01:00:00,Film wrong stuff prove.
244,New Meghan,Castroport,353.93,05:00:00,Hope war democratic threat.
245,Michaelmouth,Kevinton,978.34,01:00:00,Office can red possible policy statement sing.
246,West Brianfurt,Zavalamouth,922.15,04:00:00,Sing member idea yet.
247,New Scott,South Jonathanberg,842.82,04:00:00,Open simple should culture today attack draw.
248,Michaelland,Jamestown,358.62,03:00:00,With actually which we way.
249,Williamsmouth,North Edwardhaven,359.0,02:00:00,Available box process each.
250,Grosshaven,Nicolechester,966.71,03:00:00,Way any ago foot style opportunity.
251,East Jacobbury,Vincentmouth,657.32,04:00:00,Safe hope mean age by market.
252,Port Ryanfurt,Cassieberg,148.36,04:00:00,Crime let enjoy.
253,Edwardsport,Orrmouth,501.36,02:00:00,Parent toward clearly way art my participant.
254,Boydland,New Tyler,948.55,05:00:00,Mr really after left if may.
255,West Amber,Port Joshuafort,270.79,02:00:00,Wife recognize per Congress very although.
256,North Kevinmouth,Lake Josephville,515.84,03:00:00,Thank water financial sit.
257,New Bethanyshire,Johnside,705.33,04:00:00,House out this exactly reflect part.
258,Lake Janet,East Sherryton,393.65,02:00:00,Check agency claim.
259,Colemanshire,New Brandon,415.11,02:00:00,Unit of water than daughter turn save.
260,Vanghaven,East Davidview,788.36,05:00:00,Would especially dog really.
261,Christinaland,East Carolineborough,154.04,01:00:00,Turn time tough study.
262,New Jackiehaven,New Ann,223.31,01:00:00,Record those really glass still he.
263,Prattmouth,Jenniferville,761.55,03:00:00,Mrs teacher within take.
264,Seanburgh,Brownfurt,126.84,04:00:00,Again sing plant challenge quickly.
265,Charleschester,New Martha,678.82,03:00:00,Line population authority professor.
266,Alejandrostad,Campbellmouth,177.12,02:00:00,Loss skill charge weight him strategy.
267,West Rebecca,Port Jennifertown,386.67,02:00:00,Wind along management against artist power.
268,Dickersonbury,Patriciabury,652.71,04:00:00,Scientist imagine note owner miss degree.
269,Sandersfurt,Josehaven,596.53,04:00:00,Under receive democratic three defense.
270,Johnsonview,Greenville,729.49,03:00:00,Project mean soon hand key.
271,Martinezfort,Jeanton,886.82,03:00:00,Enough make spring usually yes.
272,Heatherview,West Jamesstad,182.92,02:00:00,If option land federal north rather play.
273,Lake Hector,Emilymouth,501.79,02:00:00,Entire song put former she alone protect.
274,Lake Adam,South Tracystad,533.94,02:00:00,Figure contain medical modern help.
275,Baileyland,Sherryfurt,428.52,05:00:00,Able technology must education mean.
276,Ronaldfort,West Annberg,980.73,02:00:00,Matter class father whom along.
277,Mistyberg,Port Nathan,266.41,04:00:00,Name under play oil director forward.
278,Williamsonside,Danielside,837.12,05:00:00,Theory understand bar lead operation.
279,New Laura,Vasquezview,735.21,03:00:00,Nice century job society.
280,Forbesbury,Johnsonburgh,247.97,04:00:00,System show trip see.
281,Danabury,New Angela,629.86,01:00:00,Buy much century them.
282,Lake Matthewview,West Billfort,925.3,04:00:00,Upon region our color office tax.
283,Leachbury,Coxport,197.93,03:00:00,Above risk leader action certain focus firm assume.
284,Lake Tracy,Kristenborough,891.76,03:00:00,Brother pick late machine player.
285,Lewisville,New Kaylashire,555.01,03:00:00,Suggest do bed nature science.
286,North Terrencetown,Jessefurt,185.04,04:00:00,Loss rather seat hand hospital miss machine.
287,Jameschester,Singhview,533.55,05:00:00,Including factor hair against child people.
288,South Robert,West Debrabury,612.11,03:00:00,After identify open bank third tax today front.
289,Snowbury,East Matthew,834.66,02:00:00,Campaign environment I theory walk day reality.
290,South Joshua,West Madison,536.58,02:00:00,Use require push last beyond debate Congress us.
291,North Kenneth,Sarahbury,782.8,01:00:00,As scene think drive note allow television.
292,Levinemouth,Farrellstad,344.58,03:00:00,Person bed start.
293,Margaretborough,Pierceport,872.86,01:00:00,Choice worker at take move.
294,Fitzgeraldshire,South Lance,581.51,02:00:00,Recognize director us recent how enter decade.
295,East Heatherville,Lake Stacey,301.86,01:00:00,Manage tell program stay lay plant.
296,West Katelyn,New Mariaborough,886.61,05:00:00,Sell fund whom cost education.
297,Mariafurt,Erinton,596.94,03:00:00,Wall here treatment hotel owner this run improve.
298,North Michaelton,North Melissa,492.25,04:00:00,Top participant phone rest produce else.
299,Brownhaven,Debrabury,243.56,02:00:00,Democrat school goal however south writer.
300,Mitchellfurt,Robertsonborough,446.29,05:00:00,Particular identify later debate item every want.
301,Oliviaport,Brownstad,528.65,04:00:00,Fly rate read local learn.
302,Lake Gregoryberg,Codyborough,360.43,04:00:00,Laugh consider forget wear view win usually.
303,East Peterborough,Lake Jenniferberg,525.22,04:00:00,Into reveal use sit site.
304,Chapmanland,Juliehaven,763.95,04:00:00,Issue former bag popular force rise.
305,Port Justin,Nathanielburgh,934.38,02:00:00,Memory appear capital own.
306,Reeseton,Annetteberg,928.51,04:00:00,Store however accept space born find us image.
307,North Ericland,East Linda,542.98,01:00:00,Movie sister Congress teach particular after maybe challenge.
308,Wilkinsside,Tiffanyland,974.59,04:00:00,Could system Mr voice hand start majority improve.
309,New Chad,New Katherineberg,542.62,02:00:00,Always wide political security but opportunity.
310,East Robertside,Port Georgeshire,171.07,02:00:00,Must store responsibility wide feeling of.
