RotaID,Origem,Destino,Distancia,TempoEstimado,RestricoesTrafego
7391,Martinezland,Calebport,413.84,02:00:00,Though add six practice ahead recognize father by.
7392,Jasonfort,Lake Kelly,789.56,02:00:00,Same party worker manager operation free.
7393,West Cody,East Ginaville,143.38,02:00:00,Yet sort include party must door its.
7394,Lake Yolanda,Lake Cassidy,291.66,05:00:00,Have several agent charge suddenly upon.
7395,New Jeffrey,Walkerfurt,741.77,01:00:00,Behind task together central apply huge.
7396,Lake Aliciamouth,Melindabury,937.39,02:00:00,Pressure everyone gun process.
7397,East Patrickville,Lake Edwin,837.01,01:00:00,Buy building radio wife choice agent.
7398,Bethmouth,Lake Craigbury,728.03,02:00:00,Agency score movie material situation however.
7399,Wongborough,Ortizborough,276.68,04:00:00,Can per region executive sometimes short.
7400,Gonzalezfurt,Davischester,520.82,02:00:00,Almost show grow soon card.
7401,South Robertburgh,South Tammychester,836.01,04:00:00,Positive go magazine make total south crime.
7402,Lake Nicholasstad,East Hayden,271.61,02:00:00,Own where admit do time level.
7403,East Joshuaport,North Jasonbury,369.31,03:00:00,Itself economy sound home plant tree cultural.
7404,East Michelletown,Middletonview,836.43,01:00:00,Understand sing feel detail.
7405,Ericaville,Lake Daisyfort,466.06,04:00:00,Life because know bad imagine show.
7406,West Tracy,Port Brandi,114.24,03:00:00,Different serve bag address sense research box.
7407,New Rebeccatown,Jamesside,293.76,05:00:00,Article hard anything under hospital too bad.
7408,Whiteberg,South Annaberg,189.44,04:00:00,Interesting thank coach environmental.
7409,Lesliestad,Tranmouth,974.99,05:00:00,Page its short call year.
7410,Port Georgeport,Tinachester,140.71,05:00:00,Concern price hour them action produce line billion.
7411,South Samanthaland,West Kylehaven,555.0,04:00:00,Pull money smile almost seek anything father.
7412,Bethton,East Wesley,344.85,04:00:00,Point response institution national hand.
7413,Leahberg,North Deannaside,237.69,05:00:00,Organization American some today spend themselves station hot.
7414,Lake Kristinmouth,South Jerry,422.63,03:00:00,The either with experience somebody.
7415,Port Jessicafurt,East Elizabethmouth,275.76,01:00:00,To religious campaign fund popular remain.
7416,Wilsonville,New Virginia,610.53,04:00:00,What generation into throughout newspaper culture.
7417,Maryside,North Robert,408.25,02:00:00,Black should individual sport evidence suffer future including.
7418,Rebeccamouth,Port Erinfort,144.04,02:00:00,Bar professional hear animal spend.
7419,Samuelfurt,Lake Louisstad,561.39,03:00:00,Whole meeting offer others chair customer here.
7420,Lake Patricia,West Grantberg,759.47,03:00:00,Water behind another mother much.
7421,Jessicaberg,North Melissabury,987.07,05:00:00,Painting weight it inside.
7422,New Amanda,Michelleburgh,185.58,04:00:00,Sound seek discover recently church theory.
7423,New Kenneth,West Logan,885.13,04:00:00,Hair red move today.
7424,West Tony,Cardenasbury,161.28,03:00:00,Into discuss support thank door challenge.
7425,Port Johnnyborough,Michaelside,426.14,02:00:00,Government perhaps size improve.
7426,Allisonborough,Brettland,151.57,03:00:00,Contain relationship sometimes stage might this.
7427,West Johnnyville,Lake Nancyfurt,283.23,01:00:00,Country guy hope talk know listen dark.
7428,East Danielside,Weaverbury,296.29,04:00:00,Approach firm history usually take history sit build.
7429,New Leslieberg,Lake Heather,219.08,02:00:00,Prove several college kid.
7430,East Sarahton,Jeremychester,115.29,01:00:00,Thought positive moment likely.
7431,Port Diana,Charlesside,758.94,04:00:00,Everyone something morning have week before few.
7432,Port Robert,Paulaside,606.08,04:00:00,Issue wrong approach place college front.
7433,West Jacobtown,New Francisco,572.12,03:00:00,Prepare begin court another.
7434,Wallsberg,Hendricksfurt,591.7,02:00:00,Case walk item real.
7435,New Tammy,North Michaelburgh,138.12,02:00:00,Ever four political pick ask.
7436,Emilyland,Mooreview,375.45,05:00:00,Store time throw television house during miss discuss.
7437,Wellsside,South Anthonychester,535.47,01:00:00,Discuss tell positive head authority into.
7438,Phillipsberg,Basston,627.28,02:00:00,Few city should history approach.
7439,Lauraborough,Lake Robert,943.6,02:00:00,Alone doctor state left surface beat professor.
7440,Donaldbury,West Annamouth,410.82,05:00:00,Particularly value buy drive man.
7441,Danafurt,Port Darleneshire,887.78,05:00:00,Stage common life gas while throw.
7442,Millerfort,Michaelstad,206.44,03:00:00,Mention action car coach level free hit.
7443,Port William,New Andrea,707.4,05:00:00,First none trial evening western all.
7444,Jamesfurt,New Shannon,410.95,05:00:00,Trip lay fire give sometimes.
7445,New Rebecca,North Sandrafort,459.38,02:00:00,Guy husband police should school property.
7446,Hubbardview,Kirbytown,545.27,04:00:00,First coach girl wife same.
7447,Port Mary,North Stephen,131.36,02:00:00,Wind serve between not far.
7448,Port Jasonborough,Aliciafort,347.48,02:00:00,Later traditional society friend politics turn your.
7449,Wilsonbury,Martinland,571.76,02:00:00,Assume either play program dream although.
7450,New Sara,Mendezhaven,325.15,03:00:00,Eight talk forget follow activity.
7451,East Michaelfort,South Markfurt,949.79,02:00:00,Weight want southern.
7452,East Timland,Lake Keithfort,921.53,04:00:00,May great college official seem just week.
7453,North Ruben,Sarahview,517.45,02:00:00,Sea down its believe high true maintain run.
7454,Port Carol,Mejiastad,784.23,02:00:00,Any every high city clearly minute field.
7455,North Daniel,South Laura,837.69,04:00:00,Beat whether piece way.
7456,North Davidstad,West Jason,597.32,02:00:00,Market attack recently environment.
7457,Kristiville,Valerieport,486.82,04:00:00,Human better since consider adult yes.
7458,New Brandon,Quinnhaven,483.77,03:00:00,Series skill act rather role price large war.
7459,Ashleytown,Lake Christopher,310.23,01:00:00,Although already sense second last especially.
7460,North Josephside,North Tanya,336.83,01:00:00,Perform job protect anything.
7461,West Janeville,Martinport,194.95,05:00:00,Create grow quality all season society.
7462,Williamchester,Perryborough,390.61,04:00:00,Maintain fund idea with analysis.
7463,New Christy,West Nathanbury,434.11,03:00:00,View five message gas single activity.
7464,Daleport,North Steven,285.44,01:00:00,Quality rise current threat once goal.
7465,Port Sarahside,Brandonmouth,973.24,05:00:00,Herself lead civil within.
7466,Trevinoport,Keithside,952.29,04:00:00,Peace seven house writer past party.
7467,Jonesland,Sanchezchester,958.43,03:00:00,Quality pretty wonder skin.
7468,Carrbury,Powersland,527.54,04:00:00,Success care police network nearly mean.
7469,North Donnaton,East Gina,592.86,04:00:00,When easy month security four easy entire.
7470,Lake Diana,Ruizfurt,711.66,03:00:00,Our west tough somebody total production.
7471,East Jeremiah,Garybury,752.92,03:00:00,Human she vote toward dream environment.
7472,East Danny,West Sandraberg,394.23,04:00:00,Several establish star compare not.
7473,Charlesstad,South Samantha,230.36,05:00:00,Story wrong hand political safe.
7474,Allisontown,South Williammouth,124.41,01:00:00,Your local forward perform drug high gas.
7475,New Patriciafurt,Lake Kimberlyberg,945.6,01:00:00,Try write spend million per.
7476,New Alicia,Rogersberg,709.87,01:00:00,Maintain computer sound arm federal.
7477,North Brandon,East Jeffrey,551.38,01:00:00,Network month sell list.
7478,North Alisonshire,Jennifermouth,464.65,02:00:00,History must night.
7479,Johnmouth,North Maryfurt,978.08,05:00:00,Never analysis position ahead itself product three apply.
7480,Natashaville,North Stephen,318.66,04:00:00,What discuss as.
7481,Lake Patricia,Port Jon,712.27,03:00:00,Several story care seek.
7482,Jessicaborough,Kristyborough,524.77,05:00:00,Require quality include simply themselves note in.
7483,Lorishire,East Taraberg,719.65,02:00:00,Treat design nation ball.
7484,Markchester,East Ashleyborough,321.38,01:00:00,Summer mean even finish.
7485,New Johnton,Smithview,553.93,01:00:00,Season day by necessary strong wish.
7486,Danielton,Hoffmanview,747.47,04:00:00,Party large morning.
7487,Ortegaville,Christensenmouth,887.3,03:00:00,Share kind partner move.
7488,West Amy,East Charles,701.06,02:00:00,Bad big sing turn.
7489,New Kennethbury,Rogersview,888.93,03:00:00,Center at both.
7490,Peterstad,Velezberg,736.21,05:00:00,Medical rock total interview movement buy executive.
7491,Brandtville,South Jaclyn,594.95,04:00:00,Story instead nearly hit sport source.
7492,Lake Melissa,Moodyfurt,646.33,01:00:00,Spend lose else speak.
7493,Williamsfort,Haleymouth,993.32,05:00:00,Page ten him money information suggest.
7494,East Amy,New Erinmouth,955.16,02:00:00,Design not executive federal determine rest institution.
7495,South Kelseyborough,Port Courtney,544.04,01:00:00,Radio later that reduce.
7496,Jonestown,North Jennifer,435.87,01:00:00,Improve side space firm positive interesting rise.
7497,Danielsmouth,Roblesshire,783.38,01:00:00,Drop respond age.
7498,East Teresa,Castrofort,224.33,01:00:00,Prevent big political.
7499,West Leonberg,East Michaelfort,994.56,03:00:00,Often trip nation know.
7500,Lake Kaitlinfurt,Daniellechester,856.99,01:00:00,Difficult gun like particularly federal thus.
7501,Matthewsside,Burkefort,798.91,02:00:00,Happy actually education air tax.
7502,Averybury,North Steven,764.7,01:00:00,Represent site consumer question example amount smile.
7503,Adamshaven,Wallaceside,772.16,03:00:00,Outside price close then.
7504,Kristenport,Lake Dianafurt,551.76,01:00:00,Color season third.
7505,Johnsborough,South Richardbury,581.64,03:00:00,Long onto dream along two.
7506,West Michellemouth,Mckinneyport,705.74,05:00:00,Study agreement whatever create.
7507,Brandonfurt,Blackwellmouth,112.14,03:00:00,Fly thousand data stage same answer.
7508,Millerland,Smithport,360.2,04:00:00,Visit seat bad finally address note.
7509,Gregoryville,East Debraborough,513.23,03:00:00,Enough politics your and skill drop picture.
7510,East Rebecca,Boonefurt,911.53,04:00:00,Require late back lawyer senior pressure energy lead.
7511,South Parker,South Bryce,286.86,02:00:00,By civil drive street any reveal management.
7512,South Heatherview,West Jeffreystad,784.91,02:00:00,Help amount today wear line.
7513,Brownborough,Lake Daltonburgh,484.19,05:00:00,Similar that important stop remember.
7514,Thorntontown,South Johnhaven,173.2,01:00:00,Model dinner opportunity it on real see.
7515,East Donnaberg,Port Benjaminburgh,470.78,01:00:00,Put establish class.
7516,Collinsborough,Longview,509.15,04:00:00,Own decide apply building include ago music.
7517,North Matthew,Lake Stephenfort,589.83,04:00:00,Always opportunity apply any hot.
7518,Gilbertburgh,Lake Bryan,411.59,03:00:00,Despite world magazine that much write term.
7519,Lake Kevin,Christopherbury,577.97,05:00:00,Mrs organization north herself sure suddenly.
7520,South Cassandraland,North Lesliebury,802.71,05:00:00,Network send administration travel.
7521,North Heather,Brendaview,747.26,04:00:00,Walk nearly seat discover nation unit.
7522,New Jesse,Schwartzburgh,934.14,02:00:00,Free approach people number and.
7523,East Amandaside,Feliciahaven,921.47,03:00:00,Station land dream your.
7524,Hollandview,Brianborough,463.7,01:00:00,Fly arrive public you suggest energy.
7525,Gonzalezmouth,Port Rachel,479.32,01:00:00,But structure perform.
7526,North Bethanybury,West Taraport,854.56,01:00:00,Dinner lawyer former reduce fish table standard task.
7527,Banksshire,West Brandon,788.89,02:00:00,Tonight impact we contain there few thus.
7528,North Aaronmouth,Nicolefort,417.64,01:00:00,Knowledge air environmental financial half.
7529,Sueberg,Buchananchester,834.33,01:00:00,After economic now team explain radio reach.
7530,Sloanfurt,New Bethshire,631.07,05:00:00,Any thing movement reduce president force watch.
7531,Lake Leslie,Richardsonfurt,407.58,05:00:00,Manage sell less bill.
7532,Figueroahaven,Laurenport,940.52,01:00:00,Both fast official mouth reflect only might.
7533,West Chelseymouth,Marcusside,539.74,03:00:00,Ground or reality turn car.
7534,Derekhaven,East Kyle,261.8,01:00:00,Reason structure this fight idea.
7535,North Mikaylamouth,Bonillaton,817.18,01:00:00,Art rich education will prove.
7536,Mccarthybury,Nathanberg,740.69,05:00:00,Reach bank fast bring there condition movement voice.
7537,Rebeccashire,Johnview,460.28,01:00:00,Remain treatment measure concern challenge meeting raise.
7538,East Ashleyshire,West Gregory,501.56,01:00:00,Various we until.
7539,Robertmouth,Patrickshire,422.14,01:00:00,Set section general morning.
7540,West Catherinefort,Bethanyview,398.29,01:00:00,Coach ready material world a just.
7541,Barbaraland,Tinaburgh,521.06,02:00:00,Score hair and budget wrong it.
7542,Lake Julietown,Lake Keithland,786.89,05:00:00,Pick color computer risk sea floor.
7543,North Kerry,Keithside,389.36,03:00:00,Soon near big.
7544,North Carolshire,South Devin,558.61,03:00:00,Teach safe picture go clearly third question.
7545,Cookmouth,West Thomasmouth,305.19,02:00:00,Reality case short stand gun.
7546,Atkinsmouth,Lake Tony,260.14,01:00:00,Heart win head assume have draw mention.
7547,Robertton,Tuckermouth,654.77,03:00:00,Avoid partner without phone account now technology.
7548,South Virginia,Wilkinsonfort,892.08,01:00:00,All usually scene share alone actually.
7549,Garciafort,Jamesfort,140.22,02:00:00,Be rise wonder feeling although sure image.
7550,Port Amanda,Lake Lisa,180.26,03:00:00,Window field human over manage skin.
7551,Rodriguezbury,Zacharymouth,622.76,02:00:00,Anything wish live practice realize themselves even.
7552,Petersonfort,Rowlandchester,612.0,02:00:00,Bit stay report company skin floor difference.
7553,South Shirley,Gordonhaven,991.19,01:00:00,South structure choice gun.
7554,North Lindaborough,South Leslie,310.69,01:00:00,Western base natural activity happy.
7555,Alexanderville,Mossmouth,303.6,04:00:00,Defense assume hard above suddenly long security.
7556,Vangton,Lake Pennyville,676.28,02:00:00,Price whole perform be cup rule.
7557,Lindseybury,Loganhaven,645.14,04:00:00,Open for wife change could.
7558,Colonview,Danielleberg,940.51,01:00:00,Recent factor brother understand address.
7559,New Sheilashire,Jessicafort,739.74,01:00:00,Social make along sister simply hand.
7560,Ethanchester,Walshchester,235.06,01:00:00,After real single guy maybe.
7561,Port Amy,Valerieberg,381.16,02:00:00,Join road whom more their.
7562,North Laura,West Taylor,628.52,03:00:00,Relationship election rich today vote.
7563,Mitchellview,Maryfort,328.19,04:00:00,Heart future easy view expect election best effect.
7564,North Jenniferside,New Andrewborough,111.19,03:00:00,Up book forward until name least.
7565,Lake John,Lake Roger,283.5,03:00:00,Election least occur area including someone.
7566,Martinburgh,East Kyleview,633.28,02:00:00,Crime yard wear program including democratic away.
7567,Dawnton,West Jasonview,388.13,02:00:00,Tend above exactly.
7568,New Michaelborough,Lake Daleton,858.22,02:00:00,Article night have clear say.
7569,North Jose,West Jenna,155.02,02:00:00,Rate color degree oil.
7570,Taylorfort,Maryton,445.87,05:00:00,Note bag first center own evidence thank.
7571,West Tracey,Wilsonhaven,318.27,01:00:00,Message collection now smile center trouble.
7572,Fowlerland,Carterburgh,185.12,01:00:00,Analysis case civil offer short phone.
7573,Sanchezstad,Lake Jason,712.18,02:00:00,Film general city kitchen concern.
7574,New Stephen,Lake Kristen,468.1,01:00:00,Class perform member should building.
7575,South Douglas,Judithfort,799.41,01:00:00,Right base face report tonight tell.
7576,Lake David,Taylorshire,891.27,05:00:00,Either prevent type machine gas.
7577,Kevinfort,Melissaberg,532.96,03:00:00,Be south right however.
7578,Thorntonhaven,Rickport,601.67,02:00:00,Set key work wait site article baby necessary.
7579,South Matthewstad,South Steven,125.71,03:00:00,Deal cause room life international listen.
7580,East Joseton,South Anita,389.1,05:00:00,Kind nor fly else little.
7581,Taylorview,West Bryan,137.62,05:00:00,Dream member American different exactly.
7582,Annestad,Caitlintown,829.89,03:00:00,Act speech nearly service cup former the.
7583,New Gregoryburgh,West Glen,527.85,05:00:00,Water some cut cup surface what military.
7584,North Loriton,South Kimberlyshire,277.6,03:00:00,Second north term million and wonder only.
7585,Charlenebury,Montesberg,675.33,04:00:00,Born especially box little seat nearly feel.
7586,Port Adrianbury,Carterhaven,278.3,03:00:00,Two claim role pay many.
7587,North Traceyborough,North Amanda,560.01,05:00:00,Federal during can gas health trip long.
7588,South Wendymouth,Sharonburgh,972.52,01:00:00,Free test daughter media.
7589,East Eric,North Rachelbury,376.44,01:00:00,Support group modern grow today service matter training.
7590,Port Michael,Lorettafort,819.35,03:00:00,Young talk toward.
7591,East Nicholasborough,West Christine,320.78,04:00:00,Bank staff realize though.
7592,Mitchellfort,Christinatown,889.89,04:00:00,Degree likely quickly less not.
7593,Lake Markport,East Brittanyport,543.61,03:00:00,Financial popular recent this hand.
7594,Michaeltown,Kathleenland,747.42,05:00:00,Now least they perform home drive range.
7595,Rodriguezfort,Tamiport,527.64,02:00:00,Project activity skin thing three recognize.
7596,North Noah,North Kimport,621.56,02:00:00,Clear receive animal alone cover role truth.
7597,Mosschester,North Stephanie,263.59,05:00:00,Test economic current necessary man.
7598,Lake Andrew,Tuckershire,428.96,03:00:00,Congress television government back measure.
7599,Alexanderbury,Reedbury,419.31,01:00:00,Face spring son just green moment.
7600,Schwartzhaven,Brandyshire,770.12,05:00:00,Support we protect decade play ago.
7601,Ariasbury,North Carolyn,772.45,03:00:00,Perform another over.
7602,Michaelside,Kimview,178.19,03:00:00,Think nothing candidate heavy behavior billion home.
7603,Gillstad,Robinstad,257.56,05:00:00,Scientist have itself fear bring.
7604,New Jomouth,West Maryshire,889.69,02:00:00,Yeah indicate model buy.
7605,Robertbury,West Curtis,631.77,05:00:00,Hot early democratic then picture.
7606,West Jessicastad,South Theresa,331.12,04:00:00,Debate bar shake address.
7607,Thomasburgh,Timothyland,283.83,05:00:00,Reach as real relationship upon.
7608,North Charlesshire,Port Michaelchester,773.24,01:00:00,Window place impact year professional say many.
7609,West Caroline,New Brandy,459.59,01:00:00,Marriage financial and key.
7610,East Josephbury,Sandrashire,628.28,03:00:00,Suggest strategy money agree these surface.
7611,Dylanmouth,New Cameronton,532.1,05:00:00,He whatever store meeting wind.
7612,Webbton,Jacobside,931.26,05:00:00,Possible central conference feeling land should enjoy.
7613,Nixonfurt,Robertsonmouth,114.39,05:00:00,Magazine result along opportunity opportunity similar sing.
7614,North Donna,Olsenmouth,446.88,03:00:00,We century health figure.
7615,Lake Jeffreyport,Scottport,335.81,01:00:00,Customer president myself share can until now society.
7616,New Bradleyborough,Claytonhaven,653.02,05:00:00,Yard market fine issue we.
7617,Bradleyberg,East Michael,432.18,01:00:00,Mouth low network finish page class.
7618,South Nicholasshire,North Jennifer,982.76,04:00:00,Many easy some prevent reality letter choice generation.
7619,Campbellhaven,Johnside,217.73,01:00:00,Land own performance when daughter marriage cover.
7620,New Douglas,South Monica,750.62,02:00:00,Real success reduce benefit couple worker.
7621,Sherrytown,South Donald,713.05,04:00:00,Also project fish nice general any structure.
7622,Veronicamouth,Lisamouth,225.31,04:00:00,Black pay country.
7623,East Elizabethfort,Dunlapville,702.21,05:00:00,Should send it research.
7624,New Brentport,Michelleberg,886.95,04:00:00,Social might she third voice fish low.
7625,Anthonyfurt,Loriville,786.61,02:00:00,Church get trade project seem performance education.
7626,Johnathanstad,Darinbury,538.5,02:00:00,Action case author win institution.
7627,Ashleeport,South Robertton,558.5,05:00:00,She hospital school.
7628,New Jose,Washingtonmouth,844.77,03:00:00,Rather resource political beautiful cup.
7629,East Daniellefurt,Geraldfurt,661.19,05:00:00,Fish land somebody unit international entire long.
7630,West Kimberlybury,Port Josephhaven,789.48,02:00:00,Program house sister poor must number science.
7631,East Ryanchester,Melissafort,569.27,05:00:00,Point win person same hair.
7632,Elizabethside,Rodriguezfort,373.09,05:00:00,Believe land lay interview step far.
7633,Rachaelbury,Martinezburgh,626.03,05:00:00,College fine sister body under prove.
7634,East Saramouth,Myersburgh,931.66,05:00:00,Republican someone thank can increase.
7635,New Jason,Christopherberg,174.53,03:00:00,Through record so whose its guy.
7636,Brownmouth,Kentview,472.01,05:00:00,Drug husband step bill.
7637,Ramirezchester,Pattersonton,275.71,05:00:00,White say draw cost second let.
7638,Thomasfort,Mikaylaton,462.97,01:00:00,Kitchen wide across expect sure daughter project.
7639,Holttown,Markport,811.74,03:00:00,Movement art I design fight.
7640,Nashtown,Jeffreyside,366.5,05:00:00,College dream east film light.
7641,Davisport,Lake Larrymouth,283.81,03:00:00,Agree stand day only such.
7642,Lisaberg,South Amanda,427.37,05:00:00,Term meeting develop population cause fine deal trial.
7643,Port Michealburgh,South Rachel,636.51,05:00:00,Again national me dog.
7644,North David,Port Amber,104.21,03:00:00,Sport as ever kid despite hear religious.
7645,Johnsonside,Victoriaton,407.86,04:00:00,Record serve strong standard black.
7646,Hillport,Lake Tracy,405.85,05:00:00,Mind off thought current increase off.
7647,Michaelchester,Mosschester,797.14,02:00:00,Tax wish near three recently fear begin generation.
7648,South Daniel,Washingtonland,629.11,04:00:00,Yet down after worry stop.
7649,South Kathleenfurt,Maddenland,970.32,01:00:00,Happy song option wonder himself eight yourself.
7650,Dannyborough,West Tonya,763.36,03:00:00,Light must against north development.
7651,New Jonathanstad,Carlachester,123.02,05:00:00,Program teacher attack story wife.
7652,New Tyronechester,West Aaron,452.74,03:00:00,Try its property able assume citizen.
7653,Warestad,Lake Jennifershire,578.02,01:00:00,Enter policy thousand training.
7654,South Gary,East Tina,950.49,04:00:00,Health meet ok return as.
7655,South Nathan,Lake Tracy,775.23,02:00:00,Act analysis school for carry technology.
7656,Smithtown,Youngport,780.04,04:00:00,Anyone whatever final money over debate second.
7657,Lake Lindaburgh,Christopherton,390.47,03:00:00,Serve son still learn during over.
7658,Markmouth,North Jaredland,965.43,02:00:00,Voice small cause wish role after western listen.
7659,Anthonymouth,Lake Erintown,949.11,02:00:00,Either brother begin there.
7660,Kendratown,Michaelburgh,440.98,05:00:00,Hospital different attorney able employee compare.
7661,North Jeremystad,New Emily,692.67,05:00:00,Hear city face young seat two.
7662,Isaactown,Boothstad,130.28,01:00:00,Model force subject lead.
7663,East Gabrielleside,South Lauraton,458.62,01:00:00,Hundred hour music education agency.
7664,Andersonborough,Thompsonville,870.81,01:00:00,Result poor pull ok wide camera sort almost.
7665,New Cynthiaborough,Pinedamouth,433.93,05:00:00,Tough ok truth hot game evening government.
7666,East Rickyborough,Port Belinda,221.38,05:00:00,Administration give building leave.
7667,East Debbie,Elliottborough,979.98,02:00:00,Civil write administration computer.
7668,Clementsville,North Haroldfurt,851.62,04:00:00,Avoid girl manager blood experience author.
7669,South Kathrynborough,Timothystad,340.53,01:00:00,Fight church big care much.
7670,Martinezbury,Fischerstad,449.48,05:00:00,Piece this wear.
7671,Ramseyside,Richardsbury,347.59,03:00:00,Score issue five true call.
7672,North Michele,New Matthewfurt,846.25,04:00:00,Never laugh why crime anyone pay citizen.
7673,Port Johnmouth,Lake Gregory,402.1,02:00:00,Civil memory including address hear.
7674,Lake Brittneychester,Alvaradofurt,699.05,05:00:00,Interview change area record they yet campaign.
7675,Toniborough,Keithshire,412.64,04:00:00,Value prevent human rate.
7676,Stephanietown,Deleonhaven,176.89,01:00:00,Skin maintain recognize trial interview theory late.
7677,Pennyview,West Dominiqueburgh,591.61,05:00:00,Speech enjoy always.
7678,Bentleyview,Lorichester,950.24,05:00:00,Wide coach brother generation dark bar where training.
7679,Stephenton,Debbiefurt,489.06,02:00:00,Care sea fact poor consider course wind.
7680,West Alanfort,East Michelemouth,806.35,05:00:00,Over role treatment.
7681,Galvanhaven,New Benjamin,530.97,05:00:00,Fund cell conference audience.
7682,Robertchester,Lake Joshuaport,573.79,01:00:00,Less society for return scene customer coach.
7683,Lake Madison,Lake Jose,479.43,02:00:00,Teacher mind success leader enter answer.
7684,Dianahaven,West Noah,332.58,03:00:00,Likely coach report.
7685,East Amymouth,South Valeriebury,365.11,04:00:00,Win always word shoulder.
7686,West Marthamouth,Dunlapstad,358.48,03:00:00,Hospital order customer often.
7687,Lake Carlastad,Lake Annaview,419.43,02:00:00,Mean say expect.
7688,Cindyfort,East Kenneth,170.35,04:00:00,Hope suggest single film customer.
7689,South Darlenemouth,East Melindamouth,174.03,01:00:00,Statement husband conference ten full.
7690,Reidview,East David,422.76,05:00:00,Save feeling trip military present ask.
7691,Cochranport,West Richard,830.76,05:00:00,Involve perform quite nothing message start.
7692,Christineview,East Donaldfurt,496.58,03:00:00,Foot air current perhaps along.
7693,Kellyshire,West Denise,766.38,05:00:00,Author policy station adult.
7694,Lake Thomasside,Lake Ashley,696.85,02:00:00,Force main be safe.
7695,West William,West Brettburgh,760.55,01:00:00,Themselves finally music onto nation.
7696,West Kenneth,Jacksonville,836.99,04:00:00,Occur listen thing throw tend fine.
7697,Perezmouth,Davisstad,649.48,04:00:00,Individual everybody special tax.
