RotaID,Origem,Destino,Distancia,TempoEstimado,RestricoesTrafego
2469,Joneston,South Kimberlyview,629.88,02:00:00,Once speak force middle situation.
2470,Lake Jillburgh,Port Sheri,175.38,04:00:00,Vote choose understand name lose.
2471,East Erin,Gomezhaven,991.69,01:00:00,Itself wear beautiful pretty although research.
2472,Lake Heatherville,Cassandrachester,914.9,01:00:00,Usually cup everything knowledge several.
2473,East Luisstad,Hallborough,543.95,03:00:00,Away reveal page reach.
2474,Port Jonathanberg,West Mariaview,149.24,01:00:00,Fund program use call window.
2475,East John,North Jasonside,599.64,05:00:00,Wrong company religious since should than.
2476,Zacharyshire,Maxwellbury,318.79,03:00:00,Than enter think beautiful second mouth protect.
2477,West Jessicamouth,Christopherville,950.34,04:00:00,Machine organization radio.
2478,South Kevin,South Jennifer,871.26,02:00:00,Congress media act.
2479,West Paula,New Tracy,404.81,04:00:00,That affect moment program become operation whose car.
2480,Spenceshire,West Josephside,333.86,03:00:00,Weight movement impact range performance space crime.
2481,North Daniel,Evelynfurt,145.83,02:00:00,Between protect various information property current.
2482,Hendersonfurt,South William,956.49,02:00:00,White focus yard recent project wind hear.
2483,East Sarah,New Toddfurt,330.69,05:00:00,Image player painting.
2484,East Jeffreyland,West Daniel,265.09,02:00:00,Tend ready why actually grow newspaper.
2485,North Markland,Michaelstad,903.3,01:00:00,Go though until officer body couple agent.
2486,New Whitney,Port Jasminehaven,743.35,01:00:00,Very able spend picture gun.
2487,Andersonland,Mercedesfort,575.09,01:00:00,Television along official choose.
2488,Yoderburgh,West Donaldland,621.66,01:00:00,Continue institution late movie.
2489,Butlerchester,Lake Craigbury,821.21,05:00:00,Beyond agreement citizen former fish democratic region.
2490,East Paul,Davisberg,791.01,03:00:00,Try painting speak main catch camera assume.
2491,West Tylermouth,Timothytown,809.77,01:00:00,Ground final instead environmental.
2492,Deckerport,Sawyerfurt,540.58,02:00:00,Than behavior which this officer in.
2493,Vincentmouth,Trevinomouth,839.55,02:00:00,Certainly public everyone.
2494,Johnfort,Millershire,857.24,03:00:00,Particular difference west western identify than fill.
2495,North Christopher,Fergusonbury,193.75,01:00:00,Final much maintain test nearly office check Congress.
2496,Smithville,South Edwardfort,267.44,01:00:00,Experience owner subject direction long they win.
2497,Port Ian,Lake Matthewport,359.62,05:00:00,Population not let strong seven seek performance.
2498,Stonebury,Thompsonfort,247.24,04:00:00,Sister program organization southern.
2499,West Leahton,Brianmouth,262.67,04:00:00,Court lawyer tax matter loss career box else.
2500,South Katrinaport,Kimberlyside,911.01,03:00:00,Director nothing land few choice.
2501,Staceyview,Brewerfort,174.94,02:00:00,Police ready experience itself close response cold.
2502,New Erik,East Mary,946.79,05:00:00,Whose direction far amount my finish.
2503,South Steven,Lauraville,720.57,05:00:00,Street event speak fast.
2504,Yangshire,Sampsonfurt,152.28,02:00:00,Involve beautiful artist seat follow decision.
2505,Mayberg,East Jeanburgh,607.71,01:00:00,Task from middle less hard present.
2506,South Cynthia,Perezton,690.76,01:00:00,Open out movie within edge.
2507,Josephside,Lake Debramouth,147.28,03:00:00,Language pattern pull no yes blue street.
2508,Abbottview,Sydneyfurt,712.05,01:00:00,Down able network pattern.
2509,Lake Mitchell,Soniashire,587.03,01:00:00,Group magazine sometimes appear ask son.
2510,Lindseyland,Kleinburgh,990.81,03:00:00,Possible single police page present eye.
2511,South Natalieville,Butlerstad,357.3,03:00:00,Home trade position during.
2512,Jasonbury,Shariview,114.57,02:00:00,Region senior talk official wall deep born.
2513,South Brian,New Julie,369.82,03:00:00,Federal idea finally.
2514,Lake Zachary,Doughertyport,533.04,05:00:00,Generation close question lawyer occur true.
2515,Port Cherylchester,North Kimberly,495.77,05:00:00,Forward hand vote resource another ago.
2516,Adamsbury,North Andrewberg,910.16,01:00:00,Now high major fight culture coach recognize care.
2517,Lucasberg,Lake Amanda,873.5,03:00:00,Hot want cold.
2518,Milestown,Jayton,399.47,03:00:00,Able suddenly ball skill accept.
2519,North Jeremyberg,North David,595.42,01:00:00,Director production class clear simply serve firm.
2520,New Jeffreymouth,West David,214.79,03:00:00,Body professor discussion green every chair fund.
2521,New Michelle,South Matthew,550.23,02:00:00,Help involve agent baby control.
2522,North Allen,Port Savannahhaven,338.3,03:00:00,Market participant subject grow event benefit.
2523,Michelleshire,South Jodimouth,308.95,05:00:00,Similar will operation thing she no.
2524,Mendozaview,Lake Audrey,999.68,04:00:00,Out rule nearly small sister century along.
2525,Davidborough,North Mistybury,741.37,05:00:00,Factor within field another sister set dark.
2526,Bowersfurt,North Samuelstad,536.62,01:00:00,Respond type step charge.
2527,South Jaredmouth,South Jefferyfort,979.65,05:00:00,Energy collection spend war.
2528,Brentstad,North Brandonside,712.59,05:00:00,Food happy remember find believe action house individual.
2529,North Natalie,Jamesburgh,605.0,05:00:00,Attorney suggest baby seat.
2530,Port Barbaraville,Mooneychester,543.61,05:00:00,Movie understand likely discover beautiful control.
2531,North Brittney,Port Andrew,202.52,04:00:00,Work toward amount protect star better.
2532,Samanthaberg,Jordanstad,348.91,02:00:00,Light hot expect product.
2533,North Lesliemouth,Brownstad,879.78,05:00:00,Many garden final good choose will official.
2534,Timothybury,New Michael,509.03,04:00:00,Man course kid face doctor sell.
2535,West Valerieburgh,Burkefurt,435.2,02:00:00,Never nature we.
2536,Morenoton,South Danamouth,158.11,01:00:00,Participant toward matter activity writer.
2537,Cameronside,West Adammouth,877.2,04:00:00,Action meeting institution peace stand strong before.
2538,Kevinport,Lake Bryan,528.5,03:00:00,Drive in add act rule bank school account.
2539,Meyershire,New Joshuatown,869.04,02:00:00,Sit culture pick eight.
2540,East Allisonside,South Natashabury,219.78,03:00:00,Field hand town knowledge present quite fear.
2541,Dicksonstad,Jesusmouth,981.34,04:00:00,Three trouble ten system left their.
2542,Jamesport,West Robert,849.44,02:00:00,Whether management defense prevent ten significant begin.
2543,Morenotown,Benjaminhaven,351.85,05:00:00,Peace population according party.
2544,West Matthewshire,New Devin,564.68,01:00:00,Yeah top say have personal yard personal store.
2545,Caldwellhaven,North Kimberlystad,185.31,05:00:00,Region especially huge.
2546,New Kendra,Port Manuel,786.2,05:00:00,Minute edge toward through.
2547,Christopherburgh,East Claire,955.24,05:00:00,Democratic save environmental beyond.
2548,East Patricia,Ayersview,630.37,05:00:00,Look customer use all opportunity strategy woman a.
2549,Crystaltown,Ashleymouth,926.15,03:00:00,Attorney whether might per.
2550,New Paige,Mitchellport,649.49,05:00:00,Medical enter third everyone often success response.
2551,Jackview,South Tiffanybury,795.74,05:00:00,Consider order so result buy and.
2552,Karenton,West Ericahaven,822.53,02:00:00,Dog behavior so me score keep set.
2553,West Jesus,Port Jameston,635.74,04:00:00,Talk in such truth and member.
2554,Peterville,Reyeston,193.53,01:00:00,Pattern start base toward weight.
2555,West Karenmouth,Parkberg,464.17,01:00:00,Figure somebody outside.
2556,Farrelltown,Chasetown,692.55,04:00:00,Eat enjoy record red summer father where.
2557,Port Gregoryburgh,Lake Kelseybury,407.48,04:00:00,Positive remain ok Republican grow picture follow.
2558,Haydenport,North Rhonda,776.77,04:00:00,Occur professor economic assume truth together anyone.
2559,Lake Teresa,Paultown,390.29,04:00:00,Right this nation.
2560,Laurafurt,South Rodneyburgh,226.37,01:00:00,Production beautiful do music.
2561,West Jessicaview,New Alexisland,575.95,05:00:00,Charge upon see force.
2562,Pamelatown,New Michellemouth,788.41,02:00:00,Reveal write art executive all guess state.
2563,Port Benjamin,North Carrie,190.91,05:00:00,Experience care political serious help end modern.
2564,Dillontown,Port Thomas,269.75,03:00:00,Without final tree four enough property yard.
2565,Roseland,Tranmouth,472.45,01:00:00,Allow left suddenly sometimes.
2566,Matthewborough,East David,808.51,01:00:00,Far stay western mention with population window.
2567,Scottchester,South Elizabethtown,357.78,05:00:00,Name red center quickly.
2568,Port Andreashire,West Sarahmouth,479.36,01:00:00,Scene heavy offer home.
2569,Port Stevefort,West Benjamin,602.06,02:00:00,Society respond house method fill.
2570,Harrischester,Schmidtburgh,975.83,01:00:00,Indicate rule citizen edge.
2571,New Hayley,Taylorstad,821.59,03:00:00,Energy kind off democratic trial open.
2572,Davismouth,West Shane,251.31,03:00:00,I significant policy property chance.
2573,Margaretshire,West Dianahaven,548.48,01:00:00,Study well trip.
2574,South Christie,Port Kimberly,442.72,01:00:00,Difficult base think herself human trial end.
2575,Port Kimberly,New Christopher,749.64,04:00:00,Top successful tell officer reveal life development late.
2576,North Jacob,Port Frankland,962.22,05:00:00,Home product scientist customer modern meeting third.
2577,East Brandon,North Toddburgh,904.7,03:00:00,Contain what century clear.
2578,Pattersonshire,Port Lisafort,416.59,01:00:00,Charge brother season.
2579,Knappside,Nicholasview,326.51,05:00:00,Marriage happy very door capital mission.
2580,East Michelleside,Port Miketon,357.74,05:00:00,Cell lose conference strong character save.
2581,Rogershaven,Lake Jason,761.72,04:00:00,Meet choice suffer street believe.
2582,West Shawnmouth,New Cynthiachester,833.23,01:00:00,Quickly store minute fear friend.
2583,Jessicaborough,Meganmouth,708.83,05:00:00,Still together trade.
2584,West Michael,East Kelly,338.78,04:00:00,Class this report.
2585,Hessshire,Port Alejandro,525.4,02:00:00,Similar seek social air someone as.
2586,East Jack,Kimberlymouth,645.41,05:00:00,Far successful policy husband significant seem.
2587,Deanberg,East Alexandra,531.8,05:00:00,Through red performance work.
2588,Brandonchester,Haroldstad,989.97,05:00:00,About real character see down direction.
2589,South Amberberg,New Deborahstad,346.16,02:00:00,Sea son behavior food tell.
2590,Blairburgh,Gonzalezview,833.8,03:00:00,Bank interview author person.
2591,North Jeremyborough,West William,798.28,05:00:00,Leave play catch enter.
2592,West Claytonchester,Davidsonstad,136.73,02:00:00,Drug have himself including.
2593,Wilsonchester,North Katherineburgh,245.34,01:00:00,Later prevent court way effect.
2594,Foleyland,Richardview,485.71,05:00:00,Rise clear within quality care bill.
2595,Lewisborough,North Jennifer,341.17,03:00:00,Ten head away media result.
2596,Lake Edwin,West Christina,244.28,05:00:00,Will bed health data father when its factor.
2597,Carlsonland,Bellfort,317.4,05:00:00,Way source like certain federal.
2598,Port Kevin,Port Joshua,425.45,05:00:00,Want collection including social official hear.
2599,Lake Tyler,Lake Gregory,978.9,03:00:00,There more easy amount total.
2600,Lopezchester,North Tamara,327.51,05:00:00,Land general call law could wife way.
2601,North Susanmouth,Lake Andresland,400.12,05:00:00,Every face story much several catch game.
2602,South Jeremy,Woodsland,413.13,04:00:00,Marriage size anything at.
2603,East Stephaniehaven,South Calvin,723.98,01:00:00,Manage wear participant pull them.
2604,Lake Mark,Port Mark,357.57,01:00:00,Garden dream structure later.
2605,Bakerville,East Kimberlymouth,803.02,04:00:00,During throughout wall ask.
2606,New Amy,New Kellyhaven,729.91,04:00:00,Term their region that.
2607,Coxland,West David,188.55,02:00:00,Home raise high despite just act officer.
2608,Alicemouth,Phillipsmouth,961.41,03:00:00,State likely letter.
2609,New Ginaton,Port Hailey,346.34,05:00:00,Second they rate.
2610,Port Dalefurt,South Taylorbury,796.5,02:00:00,Practice each she partner image sister morning.
2611,Davidhaven,Gregorymouth,274.45,04:00:00,Close southern where individual difficult.
2612,Lake Robert,West Pamela,159.1,01:00:00,Good avoid day teach only fear skill.
2613,Lake Kellyborough,Pearsonchester,590.12,02:00:00,Surface mouth top.
2614,Franklinshire,Aguilarbury,646.71,03:00:00,Treat wind born group direction.
2615,North Gary,Prattstad,954.5,03:00:00,Surface network it international suddenly court.
2616,Martinezhaven,Larsenfort,977.65,04:00:00,Rate maybe return.
2617,Carolmouth,Jefferyland,451.95,04:00:00,Two old box white do between.
2618,North Christiemouth,Michaeltown,528.86,01:00:00,Medical beyond language today recognize would.
2619,South Robert,West Brittanychester,468.03,05:00:00,Ready second anyone explain budget why.
2620,Port Jasonfort,Port Mark,735.11,05:00:00,Wish magazine floor watch scene really.
2621,South Vickiefurt,Sheilastad,361.77,02:00:00,Official education realize successful rather federal sit community.
2622,West Lindsay,West Sharon,523.47,03:00:00,Himself lawyer reduce Republican energy seem discuss show.
2623,West Emilyville,East Martha,616.91,01:00:00,Still leader various central far.
2624,Johnfort,East Jennifer,113.04,03:00:00,Police the mean.
2625,Ramirezview,South Troyborough,102.59,02:00:00,Against believe station reveal person kid.
2626,North Jasonville,Robertton,461.76,01:00:00,Tv service door offer middle issue accept.
2627,Davidshire,Port Aprilchester,476.42,03:00:00,Wind attack early here space bank our everybody.
2628,West Matthew,Williamston,715.64,03:00:00,Job PM now.
2629,Travismouth,South Jennifer,753.35,01:00:00,Thus reveal far their resource.
2630,West Julia,East Sarahton,142.39,03:00:00,Movement television make nice maintain almost everything.
2631,Kaufmantown,Lake Kristie,530.01,01:00:00,Tend expect reduce middle spring opportunity.
2632,Aliciafort,West Kayla,923.31,01:00:00,Role now she response action whole.
2633,West Walterfurt,New Coryland,293.25,04:00:00,Less certainly might focus.
2634,Brianmouth,Amandaburgh,956.77,04:00:00,Official unit change Republican up talk.
2635,East Chelsey,West Brandiview,732.42,05:00:00,Democrat stand per usually according last two.
2636,New Dominicberg,Port Ericamouth,785.99,01:00:00,Record condition any.
2637,Cowanville,Sullivanstad,745.51,01:00:00,Media room anyone measure hope car road.
2638,Lake Dianebury,Lake Cassandraburgh,883.43,03:00:00,Town treatment star truth memory.
2639,Andersonfurt,Patriciashire,719.47,02:00:00,Minute bit mouth offer man.
2640,Ericksonchester,East Victoria,636.94,05:00:00,To difference card old race occur lawyer.
2641,Lake Ryan,Ruizborough,660.79,02:00:00,Knowledge adult they couple player loss hold.
2642,Port Davidview,North Randall,219.29,02:00:00,Quickly performance research fine budget sound in.
2643,North Sara,Port Clarencemouth,347.9,03:00:00,Cost order skin study pressure.
2644,Jacksonport,Katherineport,813.96,02:00:00,Join note determine audience recently it.
2645,West Nathanmouth,North Kelly,810.57,05:00:00,Character population bag him.
2646,South Kathleen,West Brittney,999.3,03:00:00,Interesting throughout lot magazine about rate parent.
2647,Maciashaven,West Codytown,839.1,01:00:00,Dark unit too environment return security.
2648,Jamesbury,Monicaborough,544.26,02:00:00,Edge age believe second.
2649,New Brianbury,West Carlland,366.21,01:00:00,Someone prove rock certainly source.
2650,Jacquelineborough,Anthonystad,888.33,05:00:00,Crime bad grow travel describe.
2651,Wallacechester,New Patricia,830.67,02:00:00,Beyond age outside car.
2652,Stephanieton,Andreaberg,211.61,01:00:00,Finish sign hour data help street.
2653,New Joseph,West Jamesmouth,823.29,01:00:00,New can management example.
2654,New Williamstad,Port Christopherborough,576.47,05:00:00,House ok per stay plant leader store skill.
2655,Moonberg,South George,777.47,03:00:00,Law tell build amount improve enough order bring.
2656,Ryanview,Henryshire,705.29,02:00:00,Scientist later great media focus.
2657,South Juliantown,Port Alexandria,835.31,01:00:00,Future report beyond ever remain else.
2658,Dalehaven,Thompsonchester,676.38,02:00:00,Answer anything assume.
2659,Kingville,South Alison,837.91,04:00:00,Point store gun writer something.
2660,Lake Jacquelineberg,West Thomasshire,409.73,04:00:00,Begin change whom full gas threat.
2661,Shepherdmouth,South Sarahville,208.48,04:00:00,Start firm who car large.
2662,Port Michaelton,Harristown,289.38,05:00:00,Center same media also.
2663,Williamsonside,Wilsonshire,365.18,02:00:00,Seat beyond step night power both.
2664,Tonyfort,West Wendy,683.55,03:00:00,Friend plant popular official open movie.
2665,South James,North Jasonshire,286.23,01:00:00,Behavior kid past rest.
2666,Stevensberg,Barbaratown,884.64,01:00:00,Mother yourself believe loss all interview traditional.
2667,Arnoldview,South Valerie,653.34,04:00:00,Away deep decade yeah light.
2668,Lake Michael,Brownton,599.26,02:00:00,Would sit finally between impact though stop recognize.
2669,Smithbury,Murphyton,422.11,03:00:00,But fish spend his population.
2670,Jordantown,East Erintown,465.5,05:00:00,Certain parent draw home church.
2671,West Michaelbury,Smithland,925.1,01:00:00,Clearly nor positive standard ability.
2672,Kellerborough,Reesehaven,103.61,05:00:00,National factor truth foreign.
2673,Guzmanhaven,South Kristine,654.69,05:00:00,Any different keep drop beyond blood.
2674,South Cheryl,Youngberg,369.98,01:00:00,Bad style group ever.
2675,Wallstown,Lake Melissa,393.42,03:00:00,Although drop politics building name child.
2676,East Nancyview,South David,201.57,01:00:00,Threat great blood Republican street left other.
2677,New Erika,East Jamesburgh,551.65,05:00:00,Street president quality investment position court military.
2678,Tammybury,Toddtown,768.96,05:00:00,Somebody require affect ahead.
2679,North Dianahaven,Theodoreton,452.59,01:00:00,Pull response avoid he probably property.
2680,Connorfurt,Foxtown,291.49,03:00:00,Assume let window name so easy.
2681,Cameronview,Melissaberg,786.08,04:00:00,Partner relate sound true ago.
2682,North Staceyton,Frostberg,430.52,05:00:00,North care stage lay reality lead.
2683,South Heather,Timothyshire,822.49,03:00:00,Go pass possible may fight occur area.
2684,New Patriciafurt,Timothyfurt,283.37,05:00:00,Buy watch buy become manager whom.
2685,Lindsaystad,South Thomas,196.01,02:00:00,Technology go live key.
2686,Lake Rachel,New Tracieville,376.85,03:00:00,Well organization ability more.
2687,Delgadobury,South Ashley,432.57,05:00:00,Rock young main cause fall American.
2688,South Stevenstad,Jonathantown,175.8,04:00:00,Along thing relate ground citizen.
2689,Brendaberg,Crystalfort,577.79,01:00:00,Catch program often choose imagine different.
2690,Williamton,Port Christina,497.79,02:00:00,Future take month study other through.
2691,Lewisport,Brooksfurt,770.42,05:00:00,Relate your meeting near should alone.
2692,West Oliviaburgh,Bradleybury,789.39,02:00:00,Herself right decision painting simply house mind miss.
2693,Wilsonshire,New Dennischester,753.32,04:00:00,Its week baby night.
2694,Stonebury,Floresburgh,583.49,03:00:00,Enough piece do everybody will husband.
2695,Lake Katrinaport,East Heather,672.99,01:00:00,Really loss heart right couple hard.
2696,Warrenbury,East Christinaside,715.23,01:00:00,Prevent leave member hope employee store first art.
2697,Barnesland,East Gwendolyntown,783.05,02:00:00,Near respond game item.
2698,Sullivanchester,Franciscofurt,468.37,05:00:00,College structure defense land discussion.
2699,Lake Pamelashire,Port Wendy,859.59,04:00:00,Technology effort road bad account trial.
2700,Greenmouth,East Joanne,282.59,01:00:00,Trip performance agreement film partner issue church.
2701,Lake David,New Andrew,287.83,04:00:00,Inside star involve inside easy decision week risk.
2702,New Deborah,North Jasontown,707.08,01:00:00,Miss heart national open quickly response meeting.
2703,Markmouth,Andrewhaven,918.36,03:00:00,Despite indicate number impact hundred Congress.
2704,Mirandahaven,Josephburgh,728.02,01:00:00,Color if tree sign person forget.
2705,New Juanmouth,Lindatown,790.73,05:00:00,Hand least role since north road.
2706,New Amy,New Matthew,604.99,01:00:00,Data case really size campaign specific one rock.
2707,Coleport,Billyside,634.33,05:00:00,Significant hit people station company join help.
2708,Port David,New Danielle,886.59,02:00:00,Wrong would again various sell maintain.
2709,Kevinbury,East Karaside,731.86,01:00:00,Artist government best today customer political art.
2710,Port Randyton,Emilychester,747.57,04:00:00,Social you beat order lay together.
2711,West Nathaniel,Jonesmouth,862.52,02:00:00,He onto office day center agency morning.
2712,Thomasshire,New Michellemouth,314.79,01:00:00,Parent increase big fish city through need home.
2713,West Daniel,Toddfurt,368.68,01:00:00,Spend radio drug like reality.
2714,West Dylan,Stantontown,959.71,01:00:00,Include guy world drive oil wear task.
2715,Bakerborough,East Andrea,204.16,03:00:00,Should center whether politics again recent.
2716,Port Emily,New Michaelborough,450.0,01:00:00,I sign him loss either question two.
2717,Mitchelltown,Oconnorview,303.08,02:00:00,Agreement develop family kind role everything interesting.
2718,Bethanymouth,North Ashleyview,664.14,03:00:00,Science allow if address resource his figure.
2719,New Jessica,Port Ryan,956.77,04:00:00,Method ground may establish son even.
2720,South Saraport,New Matthew,593.95,03:00:00,Listen news to foot also explain be.
2721,Georgeside,Samanthaville,768.49,03:00:00,North exactly land born itself rock.
2722,Cruzland,North Charles,117.75,02:00:00,Term somebody pay policy expect go around.
2723,Allenchester,North Kathryn,580.03,01:00:00,Administration either minute can close explain form black.
2724,East Jamesfurt,Port Colinfurt,515.87,05:00:00,Our base glass hair skill.
2725,Whitneyburgh,South James,907.12,01:00:00,Investment size save team matter.
2726,North Megan,West Richardside,785.59,01:00:00,Light show report fill air either pattern.
2727,New Meganport,Martinezland,189.28,05:00:00,Project trouble left bank which quickly partner.
2728,Angelaland,Timothyborough,129.92,01:00:00,Poor kitchen quickly.
2729,Haileyshire,North Mark,466.63,03:00:00,Especially cut consumer prove.
2730,Gonzalesside,Aprilville,815.43,02:00:00,Free crime no available remember return.
2731,Conniechester,North Geraldfort,882.44,01:00:00,Sometimes account section instead wind.
2732,Lake Sabrinamouth,Chaseport,305.91,04:00:00,Plant eat age animal grow politics there enjoy.
2733,Port Jamesfort,East Michelle,265.21,04:00:00,Draw people main somebody from future.
2734,Kellyberg,North Johnny,700.79,01:00:00,Describe thus choice across.
2735,Richardsonside,Lake Tamara,532.42,01:00:00,Early outside year.
2736,New Amberland,Port Blakeport,390.69,05:00:00,Wonder hair return easy rule red know.
2737,West Matthew,Michaelberg,787.89,03:00:00,Building rock subject international.
2738,New Breanna,North Mitchelltown,714.02,04:00:00,Every worker laugh only two source.
2739,Cindyside,Hayesville,532.39,03:00:00,Try doctor reach ready.
2740,Donaldfort,South Timothy,764.21,03:00:00,Strategy miss oil area.
2741,Meghanbury,Matthewborough,733.11,02:00:00,Property find opportunity social.
2742,Melissafort,Nicoletown,252.23,05:00:00,Yet since number these Congress.
2743,Ruiztown,West Henryborough,331.71,02:00:00,Ball mouth special exist produce drop coach.
2744,Port Aaronview,South Daniel,671.37,05:00:00,This beat check final skill.
2745,Andersonberg,Bennettberg,881.87,05:00:00,Manage rate offer no.
2746,East Mark,East Autumnfurt,234.45,02:00:00,Television your effort certain fish.
2747,Loweryshire,South Gregory,838.76,03:00:00,Federal eye before left.
2748,North Amy,East Monica,283.71,01:00:00,Top least successful measure face dinner.
2749,New Mandymouth,New Sean,426.68,05:00:00,Station girl significant raise across.
2750,East Heidi,West Angelaburgh,606.09,05:00:00,One yet prevent become.
2751,Brennanshire,Lake Brandy,312.83,05:00:00,General choice generation unit understand now order.
2752,Bryantown,Lake Tyler,650.77,02:00:00,Sport fine strong friend result stock town.
2753,Jonesstad,North Crystal,439.04,02:00:00,Own before despite professor either evening one safe.
2754,New Ronald,East Brian,438.51,03:00:00,Wait professional I red.
2755,Laurenview,Johnsonburgh,966.24,02:00:00,Seem truth thought strong artist about pattern respond.
2756,Katherineland,East Johnton,550.66,03:00:00,Ask standard product score put.
2757,Wilsonmouth,South Rodney,163.93,03:00:00,Study house run both all stage million.
2758,Kyleborough,Amystad,823.37,03:00:00,Produce hope sell few.
2759,Hernandezton,Flynnborough,549.73,05:00:00,Carry order public toward window white well.
2760,West Arthur,West Geoffreychester,551.92,04:00:00,Imagine seem age senior push wish degree.
2761,Lake Elizabeth,Brandonshire,453.85,03:00:00,Apply war fact court ten prevent.
2762,East Wesley,East Ian,124.3,02:00:00,Time think themselves wife.
2763,Lake Latasha,New Caitlinborough,708.0,01:00:00,Term reflect probably dinner to.
2764,Salinasfort,North Craigfurt,915.62,03:00:00,This low require far.
2765,Karinahaven,East Michael,105.56,04:00:00,Brother large magazine our scene too too fact.
2766,East Stephanie,Joshuafort,247.03,01:00:00,Anything price church Mr choice scientist.
2767,New Laurieview,West Mark,647.25,04:00:00,During let them example light candidate what.
2768,Mcphersonhaven,Port Joshuafort,427.96,04:00:00,Economic card adult difference debate.
2769,Nelsonfort,Brycemouth,303.72,03:00:00,Hear practice administration travel he.
2770,Sarahmouth,East Noah,736.11,01:00:00,Police decade natural record where let.
2771,New Andremouth,Gutierrezview,248.68,03:00:00,Parent east price try risk.
2772,Hannahville,Port Coltonchester,515.55,01:00:00,Through most quite out campaign dog.
2773,Kathrynberg,Vasquezmouth,311.32,01:00:00,Best budget nature activity.
